[I 2026-06-19 19:08:27,112] Trial 16 finished with value: 0.8160693473193472 and parameters: {'family': 'logistic', 'percentile': 100, 'logistic_c': 21.275872228626255}. Best is trial 4 with value: 0.8262432012432013.
[I 2026-06-19 19:08:30,250] Trial 17 finished with value: 0.7512626262626263 and parameters: {'family': 'random_forest', 'percentile': 70, 'n_estimators': 700, 'min_samples_leaf': 3, 'max_depth': 'none'}. Best is trial 4 with value: 0.8262432012432013.
[I 2026-06-19 19:08:33,213] Trial 18 finished with value: 0.8194444444444443 and parameters: {'family': 'logistic', 'percentile': 80, 'logistic_c': 0.01425368592272892}. Best is trial 4 with value: 0.8262432012432013.
[I 2026-06-19 19:08:35,923] Trial 19 finished with value: 0.8260975135975135 and parameters: {'family': 'logistic', 'percentile': 80, 'logistic_c': 0.00564458917941432}. Best is trial 4 with value: 0.8262432012432013.
[I 2026-06-19 19:08:39,672] Trial 20 finished with value: 0.7432983682983683 and parameters: {'family': 'random_forest', 'percentile': 100, 'n_estimators': 800, 'min_samples_leaf': 4, 'max_depth': '16'}. Best is trial 4 with value: 0.8262432012432013.
[I 2026-06-19 19:08:41,654] Trial 21 finished with value: 0.827991452991453 and parameters: {'family': 'logistic', 'percentile': 80, 'logistic_c': 0.004429547605570954}. Best is trial 21 with value: 0.827991452991453.
[I 2026-06-19 19:08:43,990] Trial 22 finished with value: 0.8279428904428905 and parameters: {'family': 'logistic', 'percentile': 80, 'logistic_c': 0.004240477077931635}. Best is trial 21 with value: 0.827991452991453.
[I 2026-06-19 19:08:46,352] Trial 23 finished with value: 0.8279914529914529 and parameters: {'family': 'logistic', 'percentile': 90, 'logistic_c': 0.002665905578068932}. Best is trial 21 with value: 0.827991452991453.
[I 2026-06-19 19:08:48,564] Trial 24 finished with value: 0.824980574980575 and parameters: {'family': 'logistic', 'percentile': 90, 'logistic_c': 0.004328188814571475}. Best is trial 21 with value: 0.827991452991453.
[I 2026-06-19 19:08:53,270] Trial 25 finished with value: 0.8161907536907537 and parameters: {'family': 'logistic', 'percentile': 100, 'logistic_c': 0.08728270190139499}. Best is trial 21 with value: 0.827991452991453.
[I 2026-06-19 19:08:55,255] Trial 26 finished with value: 0.8279914529914529 and parameters: {'family': 'logistic', 'percentile': 80, 'logistic_c': 0.004238129984240922}. Best is trial 21 with value: 0.827991452991453.
[I 2026-06-19 19:08:58,131] Trial 27 finished with value: 0.826923076923077 and parameters: {'family': 'logistic', 'percentile': 90, 'logistic_c': 0.0033747064845795496}. Best is trial 21 with value: 0.827991452991453.
[I 2026-06-19 19:09:01,907] Trial 28 finished with value: 0.8074494949494948 and parameters: {'family': 'logistic', 'percentile': 80, 'logistic_c': 0.08722081057990494}. Best is trial 21 with value: 0.827991452991453.
[I 2026-06-19 19:09:04,591] Trial 29 finished with value: 0.75495337995338 and parameters: {'family': 'random_forest', 'percentile': 90, 'n_estimators': 600, 'min_samples_leaf': 3, 'max_depth': '8'}. Best is trial 21 with value: 0.827991452991453.
[I 2026-06-19 19:09:06,484] Trial 30 finished with value: 0.743104118104118 and parameters: {'family': 'extra_trees', 'percentile': 100, 'n_estimators': 900, 'min_samples_leaf': 4, 'max_depth': '12'}. Best is trial 21 with value: 0.827991452991453.
[I 2026-06-19 19:09:08,902] Trial 31 finished with value: 0.8253205128205128 and parameters: {'family': 'logistic', 'percentile': 80, 'logistic_c': 0.0064170832755164895}. Best is trial 21 with value: 0.827991452991453.
[I 2026-06-19 19:09:11,099] Trial 32 finished with value: 0.8297397047397046 and parameters: {'family': 'logistic', 'percentile': 80, 'logistic_c': 0.0030384405069779903}. Best is trial 32 with value: 0.8297397047397046.
[I 2026-06-19 19:09:12,633] Trial 33 finished with value: 0.826388888888889 and parameters: {'family': 'logistic', 'percentile': 90, 'logistic_c': 0.0010252964042266831}. Best is trial 32 with value: 0.8297397047397046.
[I 2026-06-19 19:09:15,246] Trial 34 finished with value: 0.8202214452214452 and parameters: {'family': 'logistic', 'percentile': 80, 'logistic_c': 0.012744686037328716}. Best is trial 32 with value: 0.8297397047397046.
[I 2026-06-19 19:09:17,015] Trial 35 finished with value: 0.8268745143745143 and parameters: {'family': 'logistic', 'percentile': 70, 'logistic_c': 0.0028251404496345877}. Best is trial 32 with value: 0.8297397047397046.
[I 2026-06-19 19:09:17,856] Trial 36 finished with value: 0.7419386169386171 and parameters: {'family': 'extra_trees', 'percentile': 80, 'n_estimators': 300, 'min_samples_leaf': 2, 'max_depth': '16'}. Best is trial 32 with value: 0.8297397047397046.
[I 2026-06-19 19:09:19,705] Trial 37 finished with value: 0.8121600621600622 and parameters: {'family': 'logistic', 'percentile': 60, 'logistic_c': 0.009223471621970347}. Best is trial 32 with value: 0.8297397047397046.
[I 2026-06-19 19:09:21,288] Trial 38 finished with value: 0.8284770784770784 and parameters: {'family': 'logistic', 'percentile': 90, 'logistic_c': 0.002154872429624922}. Best is trial 32 with value: 0.8297397047397046.
[I 2026-06-19 19:09:23,156] Trial 39 finished with value: 0.8283799533799533 and parameters: {'family': 'logistic', 'percentile': 90, 'logistic_c': 0.0023690952874309613}. Best is trial 32 with value: 0.8297397047397046.
[I 2026-06-19 19:09:24,910] Trial 40 finished with value: 0.7391219891219891 and parameters: {'family': 'extra_trees', 'percentile': 90, 'n_estimators': 800, 'min_samples_leaf': 4, 'max_depth': '12'}. Best is trial 32 with value: 0.8297397047397046.
[I 2026-06-19 19:09:26,346] Trial 41 finished with value: 0.8282342657342657 and parameters: {'family': 'logistic', 'percentile': 90, 'logistic_c': 0.0021899768129197148}. Best is trial 32 with value: 0.8297397047397046.
[I 2026-06-19 19:09:28,396] Trial 42 finished with value: 0.8285742035742035 and parameters: {'family': 'logistic', 'percentile': 90, 'logistic_c': 0.0020054834035205605}. Best is trial 32 with value: 0.8297397047397046.
[I 2026-06-19 19:09:30,348] Trial 43 finished with value: 0.8282828282828283 and parameters: {'family': 'logistic', 'percentile': 100, 'logistic_c': 0.002020604538647326}. Best is trial 32 with value: 0.8297397047397046.
[I 2026-06-19 19:09:32,304] Trial 44 finished with value: 0.8284285159285159 and parameters: {'family': 'logistic', 'percentile': 100, 'logistic_c': 0.0018467415852076786}. Best is trial 32 with value: 0.8297397047397046.
[I 2026-06-19 19:09:34,319] Trial 45 finished with value: 0.8262432012432013 and parameters: {'family': 'logistic', 'percentile': 100, 'logistic_c': 0.0010535204611876402}. Best is trial 32 with value: 0.8297397047397046.
[I 2026-06-19 19:09:37,307] Trial 46 finished with value: 0.7539821289821289 and parameters: {'family': 'random_forest', 'percentile': 100, 'n_estimators': 600, 'min_samples_leaf': 2, 'max_depth': 'none'}. Best is trial 32 with value: 0.8297397047397046.
[I 2026-06-19 19:09:40,147] Trial 47 finished with value: 0.820027195027195 and parameters: {'family': 'logistic', 'percentile': 90, 'logistic_c': 0.01051718964004603}. Best is trial 32 with value: 0.8297397047397046.
[I 2026-06-19 19:09:41,288] Trial 48 finished with value: 0.739996114996115 and parameters: {'family': 'extra_trees', 'percentile': 90, 'n_estimators': 500, 'min_samples_leaf': 5, 'max_depth': '8'}. Best is trial 32 with value: 0.8297397047397046.
[I 2026-06-19 19:09:43,253] Trial 49 finished with value: 0.8284770784770784 and parameters: {'family': 'logistic', 'percentile': 100, 'logistic_c': 0.001959549149893867}. Best is trial 32 with value: 0.8297397047397046.
Wrote strong baseline metrics: data/outputs/metrics/strong_baseline_metrics.csv (190 rows)
Wrote strong baseline predictions: data/outputs/metrics/strong_baseline_predictions.csv (101657 rows)
Wrote strong baseline model selection: reports/tables/strong_baseline_model_selection.csv (3 rows)
Wrote strong baseline protocol audit: reports/tables/strong_baseline_protocol_audit.csv
Wrote paper metric table: reports/tables/paper_metric_table.csv (729 rows)
Wrote raw combined metric table: reports/tables/paper_metric_table_raw.csv (729 rows)
Wrote experiment manifest: reports/experiment_manifest.json
severity               check                                                             message
 warning      unknown_labels                                       5688 rows have unknown labels
   error      split_coverage                                   No supervised rows in split=train
   error      split_coverage                              No supervised rows in split=validation
   error      split_coverage                                    No supervised rows in split=test
 warning split_label_balance      Split train does not contain both positive and negative labels
 warning split_label_balance Split validation does not contain both positive and negative labels
 warning split_label_balance       Split test does not contain both positive and negative labels
Traceback (most recent call last):
  File "/home/covid/Desktop/Covid-19-BTP/covid_audio_btp/scripts/12_validate_artifacts.py", line 57, in <module>
    main()
  File "/home/covid/Desktop/Covid-19-BTP/covid_audio_btp/scripts/12_validate_artifacts.py", line 53, in main
    raise_on_errors(issues)
  File "/home/covid/Desktop/Covid-19-BTP/covid_audio_btp/src/covid_audio_btp/validation.py", line 165, in raise_on_errors
    raise ValueError(f"Validation failed:\n{message}")
ValueError: Validation failed:
- split_coverage: No supervised rows in split=train
- split_coverage: No supervised rows in split=validation
- split_coverage: No supervised rows in split=test
