[I 2026-06-19 18:57:44,012] Trial 25 finished with value: 0.7936898953053201 and parameters: {'family': 'logistic', 'percentile': 70, 'logistic_c': 0.00384867720504984}. Best is trial 15 with value: 0.8025486759202236.
[I 2026-06-19 18:57:46,808] Trial 26 finished with value: 0.7500118432895923 and parameters: {'family': 'logistic', 'percentile': 80, 'logistic_c': 0.06754862884407092}. Best is trial 15 with value: 0.8025486759202236.
[I 2026-06-19 18:57:48,172] Trial 27 finished with value: 0.7941162537306362 and parameters: {'family': 'logistic', 'percentile': 60, 'logistic_c': 0.003161990002963656}. Best is trial 15 with value: 0.8025486759202236.
[I 2026-06-19 18:57:50,664] Trial 28 finished with value: 0.7967691505992704 and parameters: {'family': 'random_forest', 'percentile': 100, 'n_estimators': 600, 'min_samples_leaf': 3, 'max_depth': '8'}. Best is trial 15 with value: 0.8025486759202236.
[I 2026-06-19 18:57:51,385] Trial 29 finished with value: 0.7993273011511678 and parameters: {'family': 'logistic', 'percentile': 80, 'logistic_c': 0.0010496473768619508}. Best is trial 15 with value: 0.8025486759202236.
[I 2026-06-19 18:57:53,083] Trial 30 finished with value: 0.7770619167179875 and parameters: {'family': 'extra_trees', 'percentile': 70, 'n_estimators': 900, 'min_samples_leaf': 4, 'max_depth': '12'}. Best is trial 15 with value: 0.8025486759202236.
[I 2026-06-19 18:57:53,734] Trial 31 finished with value: 0.8012696006442749 and parameters: {'family': 'logistic', 'percentile': 60, 'logistic_c': 0.0010014685061848533}. Best is trial 15 with value: 0.8025486759202236.
[I 2026-06-19 18:57:54,568] Trial 32 finished with value: 0.7879577431427351 and parameters: {'family': 'logistic', 'percentile': 50, 'logistic_c': 0.002933472839289064}. Best is trial 15 with value: 0.8025486759202236.
[I 2026-06-19 18:57:56,245] Trial 33 finished with value: 0.7800464256952012 and parameters: {'family': 'logistic', 'percentile': 60, 'logistic_c': 0.008760686031017}. Best is trial 15 with value: 0.8025486759202236.
[I 2026-06-19 18:57:57,877] Trial 34 finished with value: 0.796816523757639 and parameters: {'family': 'logistic', 'percentile': 60, 'logistic_c': 0.0020720010241444997}. Best is trial 15 with value: 0.8025486759202236.
[I 2026-06-19 18:57:59,737] Trial 35 finished with value: 0.7955374484816903 and parameters: {'family': 'logistic', 'percentile': 70, 'logistic_c': 0.003024329791946203}. Best is trial 15 with value: 0.8025486759202236.
[I 2026-06-19 18:58:00,435] Trial 36 finished with value: 0.7835520394144677 and parameters: {'family': 'extra_trees', 'percentile': 50, 'n_estimators': 300, 'min_samples_leaf': 2, 'max_depth': '16'}. Best is trial 15 with value: 0.8025486759202236.
[I 2026-06-19 18:58:02,644] Trial 37 finished with value: 0.7660713439765029 and parameters: {'family': 'logistic', 'percentile': 80, 'logistic_c': 0.01684048483260021}. Best is trial 15 with value: 0.8025486759202236.
[I 2026-06-19 18:58:03,932] Trial 38 finished with value: 0.7966744042825336 and parameters: {'family': 'logistic', 'percentile': 60, 'logistic_c': 0.002183588890693188}. Best is trial 15 with value: 0.8025486759202236.
[I 2026-06-19 18:58:05,979] Trial 39 finished with value: 0.7868681605002606 and parameters: {'family': 'logistic', 'percentile': 70, 'logistic_c': 0.006946274991348339}. Best is trial 15 with value: 0.8025486759202236.
[I 2026-06-19 18:58:07,475] Trial 40 finished with value: 0.7811360083376759 and parameters: {'family': 'extra_trees', 'percentile': 80, 'n_estimators': 800, 'min_samples_leaf': 4, 'max_depth': '12'}. Best is trial 15 with value: 0.8025486759202236.
[I 2026-06-19 18:58:08,295] Trial 41 finished with value: 0.8014590932777489 and parameters: {'family': 'logistic', 'percentile': 70, 'logistic_c': 0.0011082893786276903}. Best is trial 15 with value: 0.8025486759202236.
[I 2026-06-19 18:58:09,097] Trial 42 finished with value: 0.8017907053863282 and parameters: {'family': 'logistic', 'percentile': 70, 'logistic_c': 0.001100155161881918}. Best is trial 15 with value: 0.8025486759202236.
[I 2026-06-19 18:58:10,287] Trial 43 finished with value: 0.7964375384906912 and parameters: {'family': 'logistic', 'percentile': 60, 'logistic_c': 0.0021566169643991535}. Best is trial 15 with value: 0.8025486759202236.
[I 2026-06-19 18:58:12,065] Trial 44 finished with value: 0.7907053863281065 and parameters: {'family': 'logistic', 'percentile': 70, 'logistic_c': 0.00544234989706594}. Best is trial 15 with value: 0.8025486759202236.
[I 2026-06-19 18:58:13,576] Trial 45 finished with value: 0.7984272111421669 and parameters: {'family': 'logistic', 'percentile': 70, 'logistic_c': 0.0018534582226252966}. Best is trial 15 with value: 0.8025486759202236.
[I 2026-06-19 18:58:16,229] Trial 46 finished with value: 0.7852100999573641 and parameters: {'family': 'random_forest', 'percentile': 90, 'n_estimators': 600, 'min_samples_leaf': 2, 'max_depth': 'none'}. Best is trial 15 with value: 0.8025486759202236.
[I 2026-06-19 18:58:17,696] Trial 47 finished with value: 0.7941636268890047 and parameters: {'family': 'logistic', 'percentile': 80, 'logistic_c': 0.002073657168657553}. Best is trial 15 with value: 0.8025486759202236.
[I 2026-06-19 18:58:18,681] Trial 48 finished with value: 0.7736984224738265 and parameters: {'family': 'extra_trees', 'percentile': 70, 'n_estimators': 500, 'min_samples_leaf': 5, 'max_depth': '8'}. Best is trial 15 with value: 0.8025486759202236.
[I 2026-06-19 18:58:19,320] Trial 49 finished with value: 0.8010801080108011 and parameters: {'family': 'logistic', 'percentile': 60, 'logistic_c': 0.0010731609335290014}. Best is trial 15 with value: 0.8025486759202236.
/home/covid/Desktop/Covid-19-BTP/covid_audio_btp/.venv/lib/python3.12/site-packages/sklearn/utils/validation.py:2827: UserWarning: X does not have valid feature names, but LGBMClassifier was fitted with feature names
  warnings.warn(
/home/covid/Desktop/Covid-19-BTP/covid_audio_btp/.venv/lib/python3.12/site-packages/sklearn/utils/validation.py:2827: UserWarning: X does not have valid feature names, but LGBMClassifier was fitted with feature names
  warnings.warn(
[I 2026-06-19 19:00:57,078] A new study created in memory with name: no-name-2ac02fe0-1ee3-43be-84af-928d8afb7a8b
[I 2026-06-19 19:00:57,779] Trial 0 finished with value: 0.7089555845536707 and parameters: {'family': 'extra_trees', 'percentile': 80, 'n_estimators': 400, 'min_samples_leaf': 1, 'max_depth': '4'}. Best is trial 0 with value: 0.7089555845536707.
[I 2026-06-19 19:00:59,286] Trial 1 finished with value: 0.7926634768740032 and parameters: {'family': 'logistic', 'percentile': 50, 'logistic_c': 0.0066240595682091315}. Best is trial 1 with value: 0.7926634768740032.
[I 2026-06-19 19:01:00,630] Trial 2 finished with value: 0.7486830022715191 and parameters: {'family': 'extra_trees', 'percentile': 60, 'n_estimators': 700, 'min_samples_leaf': 1, 'max_depth': '12'}. Best is trial 1 with value: 0.7926634768740032.
[I 2026-06-19 19:01:01,339] Trial 3 finished with value: 0.7089555845536707 and parameters: {'family': 'extra_trees', 'percentile': 80, 'n_estimators': 400, 'min_samples_leaf': 1, 'max_depth': '4'}. Best is trial 1 with value: 0.7926634768740032.
[I 2026-06-19 19:01:02,470] Trial 4 finished with value: 0.7978348074041854 and parameters: {'family': 'logistic', 'percentile': 70, 'logistic_c': 0.0014254814784217286}. Best is trial 4 with value: 0.7978348074041854.
[I 2026-06-19 19:01:06,617] Trial 5 finished with value: 0.7784060702720991 and parameters: {'family': 'logistic', 'percentile': 60, 'logistic_c': 0.21301372721189435}. Best is trial 4 with value: 0.7978348074041854.
[I 2026-06-19 19:01:10,088] Trial 6 finished with value: 0.7309941520467836 and parameters: {'family': 'random_forest', 'percentile': 90, 'n_estimators': 1000, 'min_samples_leaf': 5, 'max_depth': '4'}. Best is trial 4 with value: 0.7978348074041854.
[I 2026-06-19 19:01:11,123] Trial 7 finished with value: 0.7392102846648301 and parameters: {'family': 'extra_trees', 'percentile': 90, 'n_estimators': 500, 'min_samples_leaf': 2, 'max_depth': '16'}. Best is trial 4 with value: 0.7978348074041854.
[I 2026-06-19 19:01:15,380] Trial 8 finished with value: 0.7760378908704267 and parameters: {'family': 'logistic', 'percentile': 90, 'logistic_c': 1.4611205138065535}. Best is trial 4 with value: 0.7978348074041854.
[I 2026-06-19 19:01:16,055] Trial 9 finished with value: 0.739935237542893 and parameters: {'family': 'extra_trees', 'percentile': 60, 'n_estimators': 300, 'min_samples_leaf': 5, 'max_depth': 'none'}. Best is trial 4 with value: 0.7978348074041854.
[I 2026-06-19 19:01:19,565] Trial 10 finished with value: 0.738581992170509 and parameters: {'family': 'random_forest', 'percentile': 40, 'n_estimators': 1000, 'min_samples_leaf': 3, 'max_depth': '8'}. Best is trial 4 with value: 0.7978348074041854.
[I 2026-06-19 19:01:20,208] Trial 11 finished with value: 0.7792276835339037 and parameters: {'family': 'logistic', 'percentile': 40, 'logistic_c': 0.0011234362079909188}. Best is trial 4 with value: 0.7978348074041854.
[I 2026-06-19 19:01:21,426] Trial 12 finished with value: 0.7889420520999468 and parameters: {'family': 'logistic', 'percentile': 50, 'logistic_c': 0.0017164142601062626}. Best is trial 4 with value: 0.7978348074041854.
[I 2026-06-19 19:01:23,634] Trial 13 finished with value: 0.7959499299212218 and parameters: {'family': 'logistic', 'percentile': 70, 'logistic_c': 0.020341690646828656}. Best is trial 4 with value: 0.7978348074041854.
[I 2026-06-19 19:01:26,567] Trial 14 finished with value: 0.7919868541878111 and parameters: {'family': 'logistic', 'percentile': 70, 'logistic_c': 0.03458075594417433}. Best is trial 4 with value: 0.7978348074041854.
[I 2026-06-19 19:01:28,639] Trial 15 finished with value: 0.7950799864675463 and parameters: {'family': 'logistic', 'percentile': 70, 'logistic_c': 0.023754966069769793}. Best is trial 4 with value: 0.7978348074041854.
[I 2026-06-19 19:01:32,061] Trial 16 finished with value: 0.7962640761683824 and parameters: {'family': 'logistic', 'percentile': 100, 'logistic_c': 21.275872228626255}. Best is trial 4 with value: 0.7978348074041854.
[I 2026-06-19 19:01:35,140] Trial 17 finished with value: 0.750084577835774 and parameters: {'family': 'random_forest', 'percentile': 100, 'n_estimators': 700, 'min_samples_leaf': 3, 'max_depth': 'none'}. Best is trial 4 with value: 0.7978348074041854.
[I 2026-06-19 19:01:38,347] Trial 18 finished with value: 0.7971098545261225 and parameters: {'family': 'logistic', 'percentile': 100, 'logistic_c': 29.803468870872535}. Best is trial 4 with value: 0.7978348074041854.
[I 2026-06-19 19:01:43,712] Trial 19 finished with value: 0.7853172877096323 and parameters: {'family': 'logistic', 'percentile': 80, 'logistic_c': 27.544421082443318}. Best is trial 4 with value: 0.7978348074041854.
[I 2026-06-19 19:01:47,104] Trial 20 finished with value: 0.7477647286259728 and parameters: {'family': 'random_forest', 'percentile': 100, 'n_estimators': 800, 'min_samples_leaf': 4, 'max_depth': '16'}. Best is trial 4 with value: 0.7978348074041854.
[I 2026-06-19 19:01:50,968] Trial 21 finished with value: 0.7971098545261226 and parameters: {'family': 'logistic', 'percentile': 100, 'logistic_c': 20.497304521067694}. Best is trial 4 with value: 0.7978348074041854.
[I 2026-06-19 19:01:55,209] Trial 22 finished with value: 0.7727997680150789 and parameters: {'family': 'logistic', 'percentile': 90, 'logistic_c': 4.339516111995373}. Best is trial 4 with value: 0.7978348074041854.
[I 2026-06-19 19:01:58,654] Trial 23 finished with value: 0.8032477888937218 and parameters: {'family': 'logistic', 'percentile': 100, 'logistic_c': 4.036113505719297}. Best is trial 23 with value: 0.8032477888937218.
[I 2026-06-19 19:02:03,968] Trial 24 finished with value: 0.7755545889517182 and parameters: {'family': 'logistic', 'percentile': 90, 'logistic_c': 2.7695274722089303}. Best is trial 23 with value: 0.8032477888937218.
[I 2026-06-19 19:02:08,454] Trial 25 finished with value: 0.8012179208351456 and parameters: {'family': 'logistic', 'percentile': 100, 'logistic_c': 0.40548225400863436}. Best is trial 23 with value: 0.8032477888937218.
[I 2026-06-19 19:02:12,859] Trial 26 finished with value: 0.7873954859600792 and parameters: {'family': 'logistic', 'percentile': 80, 'logistic_c': 0.3770199942650913}. Best is trial 23 with value: 0.8032477888937218.
[I 2026-06-19 19:02:16,180] Trial 27 finished with value: 0.8006379585326954 and parameters: {'family': 'logistic', 'percentile': 100, 'logistic_c': 0.20432560160177676}. Best is trial 23 with value: 0.8032477888937218.
[I 2026-06-19 19:02:20,024] Trial 28 finished with value: 0.8012179208351458 and parameters: {'family': 'logistic', 'percentile': 100, 'logistic_c': 0.2581231289862252}. Best is trial 23 with value: 0.8032477888937218.
[I 2026-06-19 19:02:22,491] Trial 29 finished with value: 0.7437049925088203 and parameters: {'family': 'random_forest', 'percentile': 90, 'n_estimators': 600, 'min_samples_leaf': 3, 'max_depth': '8'}. Best is trial 23 with value: 0.8032477888937218.
[I 2026-06-19 19:02:24,159] Trial 30 finished with value: 0.742738388671403 and parameters: {'family': 'extra_trees', 'percentile': 100, 'n_estimators': 900, 'min_samples_leaf': 4, 'max_depth': '12'}. Best is trial 23 with value: 0.8032477888937218.
[I 2026-06-19 19:02:27,746] Trial 31 finished with value: 0.8008796094920496 and parameters: {'family': 'logistic', 'percentile': 100, 'logistic_c': 0.22396152319008522}. Best is trial 23 with value: 0.8032477888937218.
[I 2026-06-19 19:02:32,053] Trial 32 finished with value: 0.8014112416026292 and parameters: {'family': 'logistic', 'percentile': 100, 'logistic_c': 0.8376138114497531}. Best is trial 23 with value: 0.8032477888937218.
[I 2026-06-19 19:02:36,818] Trial 33 finished with value: 0.7763762022135228 and parameters: {'family': 'logistic', 'percentile': 90, 'logistic_c': 0.8066823424411405}. Best is trial 23 with value: 0.8032477888937218.
[I 2026-06-19 19:02:40,148] Trial 34 finished with value: 0.8009762698757914 and parameters: {'family': 'logistic', 'percentile': 100, 'logistic_c': 0.08222797294373627}. Best is trial 23 with value: 0.8032477888937218.
[I 2026-06-19 19:02:45,788] Trial 35 finished with value: 0.8020395340969504 and parameters: {'family': 'logistic', 'percentile': 100, 'logistic_c': 4.329020429775383}. Best is trial 23 with value: 0.8032477888937218.
[I 2026-06-19 19:02:46,521] Trial 36 finished with value: 0.7429800396307573 and parameters: {'family': 'extra_trees', 'percentile': 90, 'n_estimators': 300, 'min_samples_leaf': 2, 'max_depth': '16'}. Best is trial 23 with value: 0.8032477888937218.
[I 2026-06-19 19:02:53,312] Trial 37 finished with value: 0.7833357498429269 and parameters: {'family': 'logistic', 'percentile': 80, 'logistic_c': 6.743511462483615}. Best is trial 23 with value: 0.8032477888937218.
[I 2026-06-19 19:02:58,888] Trial 38 finished with value: 0.8016045623701127 and parameters: {'family': 'logistic', 'percentile': 100, 'logistic_c': 1.617477360371179}. Best is trial 23 with value: 0.8032477888937218.
[I 2026-06-19 19:03:04,250] Trial 39 finished with value: 0.7704799188052777 and parameters: {'family': 'logistic', 'percentile': 90, 'logistic_c': 8.44390333107699}. Best is trial 23 with value: 0.8032477888937218.
[I 2026-06-19 19:03:05,778] Trial 40 finished with value: 0.7462181624861051 and parameters: {'family': 'extra_trees', 'percentile': 90, 'n_estimators': 800, 'min_samples_leaf': 4, 'max_depth': '12'}. Best is trial 23 with value: 0.8032477888937218.
[I 2026-06-19 19:03:10,927] Trial 41 finished with value: 0.8017495529457253 and parameters: {'family': 'logistic', 'percentile': 100, 'logistic_c': 1.7047627680567259}. Best is trial 23 with value: 0.8032477888937218.
[I 2026-06-19 19:03:16,580] Trial 42 finished with value: 0.8019428737132086 and parameters: {'family': 'logistic', 'percentile': 100, 'logistic_c': 1.573905886892735}. Best is trial 23 with value: 0.8032477888937218.
[I 2026-06-19 19:03:21,763] Trial 43 finished with value: 0.8006862887245663 and parameters: {'family': 'logistic', 'percentile': 100, 'logistic_c': 1.9562657319339591}. Best is trial 23 with value: 0.8032477888937218.
[I 2026-06-19 19:03:27,246] Trial 44 finished with value: 0.7733314001256585 and parameters: {'family': 'logistic', 'percentile': 90, 'logistic_c': 9.32034713287948}. Best is trial 23 with value: 0.8032477888937218.
[I 2026-06-19 19:03:30,348] Trial 45 finished with value: 0.8011212604514041 and parameters: {'family': 'logistic', 'percentile': 100, 'logistic_c': 1.2097852543199223}. Best is trial 23 with value: 0.8032477888937218.
[I 2026-06-19 19:03:33,076] Trial 46 finished with value: 0.755690880092794 and parameters: {'family': 'random_forest', 'percentile': 100, 'n_estimators': 600, 'min_samples_leaf': 2, 'max_depth': 'none'}. Best is trial 23 with value: 0.8032477888937218.
[I 2026-06-19 19:03:38,028] Trial 47 finished with value: 0.7739113624281088 and parameters: {'family': 'logistic', 'percentile': 90, 'logistic_c': 2.692198372500537}. Best is trial 23 with value: 0.8032477888937218.
[I 2026-06-19 19:03:39,033] Trial 48 finished with value: 0.740998501764052 and parameters: {'family': 'extra_trees', 'percentile': 100, 'n_estimators': 500, 'min_samples_leaf': 5, 'max_depth': '8'}. Best is trial 23 with value: 0.8032477888937218.
[I 2026-06-19 19:03:45,045] Trial 49 finished with value: 0.7748779662655261 and parameters: {'family': 'logistic', 'percentile': 90, 'logistic_c': 3.8951784322376386}. Best is trial 23 with value: 0.8032477888937218.
/home/covid/Desktop/Covid-19-BTP/covid_audio_btp/.venv/lib/python3.12/site-packages/sklearn/utils/validation.py:2827: UserWarning: X does not have valid feature names, but LGBMClassifier was fitted with feature names
  warnings.warn(
/home/covid/Desktop/Covid-19-BTP/covid_audio_btp/.venv/lib/python3.12/site-packages/sklearn/utils/validation.py:2827: UserWarning: X does not have valid feature names, but LGBMClassifier was fitted with feature names
  warnings.warn(
[I 2026-06-19 19:07:44,592] A new study created in memory with name: no-name-42da5309-60da-4e70-a400-29e656556d95
[I 2026-06-19 19:07:45,387] Trial 0 finished with value: 0.7170260295260295 and parameters: {'family': 'extra_trees', 'percentile': 80, 'n_estimators': 400, 'min_samples_leaf': 1, 'max_depth': '4'}. Best is trial 0 with value: 0.7170260295260295.
[I 2026-06-19 19:07:46,835] Trial 1 finished with value: 0.8152680652680652 and parameters: {'family': 'logistic', 'percentile': 50, 'logistic_c': 0.0066240595682091315}. Best is trial 1 with value: 0.8152680652680652.
[I 2026-06-19 19:07:48,334] Trial 2 finished with value: 0.7524766899766899 and parameters: {'family': 'extra_trees', 'percentile': 60, 'n_estimators': 700, 'min_samples_leaf': 1, 'max_depth': '12'}. Best is trial 1 with value: 0.8152680652680652.
[I 2026-06-19 19:07:49,148] Trial 3 finished with value: 0.7170260295260295 and parameters: {'family': 'extra_trees', 'percentile': 80, 'n_estimators': 400, 'min_samples_leaf': 1, 'max_depth': '4'}. Best is trial 1 with value: 0.8152680652680652.
[I 2026-06-19 19:07:51,167] Trial 4 finished with value: 0.8262432012432013 and parameters: {'family': 'logistic', 'percentile': 70, 'logistic_c': 0.0014254814784217286}. Best is trial 4 with value: 0.8262432012432013.
[I 2026-06-19 19:07:55,415] Trial 5 finished with value: 0.7963286713286712 and parameters: {'family': 'logistic', 'percentile': 60, 'logistic_c': 0.21301372721189435}. Best is trial 4 with value: 0.8262432012432013.
[I 2026-06-19 19:07:59,108] Trial 6 finished with value: 0.734411421911422 and parameters: {'family': 'random_forest', 'percentile': 90, 'n_estimators': 1000, 'min_samples_leaf': 5, 'max_depth': '4'}. Best is trial 4 with value: 0.8262432012432013.
[I 2026-06-19 19:08:00,292] Trial 7 finished with value: 0.7470376845376846 and parameters: {'family': 'extra_trees', 'percentile': 90, 'n_estimators': 500, 'min_samples_leaf': 2, 'max_depth': '16'}. Best is trial 4 with value: 0.8262432012432013.
[I 2026-06-19 19:08:06,558] Trial 8 finished with value: 0.8031759906759907 and parameters: {'family': 'logistic', 'percentile': 90, 'logistic_c': 1.4611205138065535}. Best is trial 4 with value: 0.8262432012432013.
[I 2026-06-19 19:08:07,336] Trial 9 finished with value: 0.7465034965034965 and parameters: {'family': 'extra_trees', 'percentile': 60, 'n_estimators': 300, 'min_samples_leaf': 5, 'max_depth': 'none'}. Best is trial 4 with value: 0.8262432012432013.
[I 2026-06-19 19:08:11,101] Trial 10 finished with value: 0.7479603729603729 and parameters: {'family': 'random_forest', 'percentile': 40, 'n_estimators': 1000, 'min_samples_leaf': 3, 'max_depth': '8'}. Best is trial 4 with value: 0.8262432012432013.
[I 2026-06-19 19:08:12,747] Trial 11 finished with value: 0.8003593628593628 and parameters: {'family': 'logistic', 'percentile': 40, 'logistic_c': 0.0011234362079909188}. Best is trial 4 with value: 0.8262432012432013.
[I 2026-06-19 19:08:14,170] Trial 12 finished with value: 0.8118201243201244 and parameters: {'family': 'logistic', 'percentile': 50, 'logistic_c': 0.0017164142601062626}. Best is trial 4 with value: 0.8262432012432013.
[I 2026-06-19 19:08:16,798] Trial 13 finished with value: 0.8186674436674437 and parameters: {'family': 'logistic', 'percentile': 70, 'logistic_c': 0.020341690646828656}. Best is trial 4 with value: 0.8262432012432013.
[I 2026-06-19 19:08:19,545] Trial 14 finished with value: 0.8157051282051281 and parameters: {'family': 'logistic', 'percentile': 70, 'logistic_c': 0.03458075594417433}. Best is trial 4 with value: 0.8262432012432013.
[I 2026-06-19 19:08:22,262] Trial 15 finished with value: 0.8180361305361304 and parameters: {'family': 'logistic', 'percentile': 70, 'logistic_c': 0.023754966069769793}. Best is trial 4 with value: 0.8262432012432013.
