nohup: ignoring input
/home/covid/Desktop/Covid-19-BTP/covid_audio_btp/.venv/lib/python3.12/site-packages/librosa/core/pitch.py:103: UserWarning: Trying to estimate tuning from empty frequency set.
  return pitch_tuning(
Strong feature extraction progress: 250/43476 rows
Strong feature extraction progress: 500/43476 rows
Strong feature extraction progress: 750/43476 rows
Strong feature extraction progress: 1000/43476 rows
Strong feature extraction progress: 1250/43476 rows
Strong feature extraction progress: 1500/43476 rows
Strong feature extraction progress: 1750/43476 rows
Strong feature extraction progress: 2000/43476 rows
Strong feature extraction progress: 2250/43476 rows
Strong feature extraction progress: 2500/43476 rows
Strong feature extraction progress: 2750/43476 rows
Strong feature extraction progress: 3000/43476 rows
Strong feature extraction progress: 3250/43476 rows
Strong feature extraction progress: 3500/43476 rows
Strong feature extraction progress: 3750/43476 rows
Strong feature extraction progress: 4000/43476 rows
Strong feature extraction progress: 4250/43476 rows
Strong feature extraction progress: 4500/43476 rows
Strong feature extraction progress: 4750/43476 rows
Strong feature extraction progress: 5000/43476 rows
Strong feature extraction progress: 5250/43476 rows
Strong feature extraction progress: 5500/43476 rows
Strong feature extraction progress: 5750/43476 rows
Strong feature extraction progress: 6000/43476 rows
Strong feature extraction progress: 6250/43476 rows
Strong feature extraction progress: 6500/43476 rows
Strong feature extraction progress: 6750/43476 rows
Strong feature extraction progress: 7000/43476 rows
Strong feature extraction progress: 7250/43476 rows
Strong feature extraction progress: 7500/43476 rows
Strong feature extraction progress: 7750/43476 rows
Strong feature extraction progress: 8000/43476 rows
Strong feature extraction progress: 8250/43476 rows
Strong feature extraction progress: 8500/43476 rows
Strong feature extraction progress: 8750/43476 rows
Strong feature extraction progress: 9000/43476 rows
Strong feature extraction progress: 9250/43476 rows
Strong feature extraction progress: 9500/43476 rows
Strong feature extraction progress: 9750/43476 rows
Strong feature extraction progress: 10000/43476 rows
Strong feature extraction progress: 10250/43476 rows
Strong feature extraction progress: 10500/43476 rows
Strong feature extraction progress: 10750/43476 rows
Strong feature extraction progress: 11000/43476 rows
Strong feature extraction progress: 11250/43476 rows
Strong feature extraction progress: 11500/43476 rows
Strong feature extraction progress: 11750/43476 rows
Strong feature extraction progress: 12000/43476 rows
Strong feature extraction progress: 12250/43476 rows
Strong feature extraction progress: 12500/43476 rows
Strong feature extraction progress: 12750/43476 rows
Strong feature extraction progress: 13000/43476 rows
Strong feature extraction progress: 13250/43476 rows
Strong feature extraction progress: 13500/43476 rows
Strong feature extraction progress: 13750/43476 rows
Strong feature extraction progress: 14000/43476 rows
Strong feature extraction progress: 14250/43476 rows
Strong feature extraction progress: 14500/43476 rows
Strong feature extraction progress: 14750/43476 rows
Strong feature extraction progress: 15000/43476 rows
Strong feature extraction progress: 15250/43476 rows
Strong feature extraction progress: 15500/43476 rows
Strong feature extraction progress: 15750/43476 rows
Strong feature extraction progress: 16000/43476 rows
Strong feature extraction progress: 16250/43476 rows
Strong feature extraction progress: 16500/43476 rows
Strong feature extraction progress: 16750/43476 rows
Strong feature extraction progress: 17000/43476 rows
Strong feature extraction progress: 17250/43476 rows
Strong feature extraction progress: 17500/43476 rows
Strong feature extraction progress: 17750/43476 rows
Strong feature extraction progress: 18000/43476 rows
Strong feature extraction progress: 18250/43476 rows
Strong feature extraction progress: 18500/43476 rows
Strong feature extraction progress: 18750/43476 rows
Strong feature extraction progress: 19000/43476 rows
Strong feature extraction progress: 19250/43476 rows
Strong feature extraction progress: 19500/43476 rows
Strong feature extraction progress: 19750/43476 rows
Strong feature extraction progress: 20000/43476 rows
Strong feature extraction progress: 20250/43476 rows
Strong feature extraction progress: 20500/43476 rows
Strong feature extraction progress: 20750/43476 rows
Strong feature extraction progress: 21000/43476 rows
Strong feature extraction progress: 21250/43476 rows
Strong feature extraction progress: 21500/43476 rows
Strong feature extraction progress: 21750/43476 rows
Strong feature extraction progress: 22000/43476 rows
Strong feature extraction progress: 22250/43476 rows
Strong feature extraction progress: 22500/43476 rows
Strong feature extraction progress: 22750/43476 rows
Strong feature extraction progress: 23000/43476 rows
Strong feature extraction progress: 23250/43476 rows
Strong feature extraction progress: 23500/43476 rows
Strong feature extraction progress: 23750/43476 rows
Strong feature extraction progress: 24000/43476 rows
Strong feature extraction progress: 24250/43476 rows
Strong feature extraction progress: 24500/43476 rows
Strong feature extraction progress: 24750/43476 rows
Strong feature extraction progress: 25000/43476 rows
Strong feature extraction progress: 25250/43476 rows
Strong feature extraction progress: 25500/43476 rows
Strong feature extraction progress: 25750/43476 rows
Strong feature extraction progress: 26000/43476 rows
Strong feature extraction progress: 26250/43476 rows
Strong feature extraction progress: 26500/43476 rows
Strong feature extraction progress: 26750/43476 rows
Strong feature extraction progress: 27000/43476 rows
Strong feature extraction progress: 27250/43476 rows
Strong feature extraction progress: 27500/43476 rows
Strong feature extraction progress: 27750/43476 rows
Strong feature extraction progress: 28000/43476 rows
Strong feature extraction progress: 28250/43476 rows
Strong feature extraction progress: 28500/43476 rows
Strong feature extraction progress: 28750/43476 rows
Strong feature extraction progress: 29000/43476 rows
Strong feature extraction progress: 29250/43476 rows
Strong feature extraction progress: 29500/43476 rows
Strong feature extraction progress: 29750/43476 rows
Strong feature extraction progress: 30000/43476 rows
Strong feature extraction progress: 30250/43476 rows
Strong feature extraction progress: 30500/43476 rows
Strong feature extraction progress: 30750/43476 rows
Strong feature extraction progress: 31000/43476 rows
Strong feature extraction progress: 31250/43476 rows
Strong feature extraction progress: 31500/43476 rows
Strong feature extraction progress: 31750/43476 rows
Strong feature extraction progress: 32000/43476 rows
Strong feature extraction progress: 32250/43476 rows
Strong feature extraction progress: 32500/43476 rows
Strong feature extraction progress: 32750/43476 rows
Strong feature extraction progress: 33000/43476 rows
Strong feature extraction progress: 33250/43476 rows
Strong feature extraction progress: 33500/43476 rows
Strong feature extraction progress: 33750/43476 rows
Strong feature extraction progress: 34000/43476 rows
Strong feature extraction progress: 34250/43476 rows
Strong feature extraction progress: 34500/43476 rows
Strong feature extraction progress: 34750/43476 rows
Strong feature extraction progress: 35000/43476 rows
Strong feature extraction progress: 35250/43476 rows
Strong feature extraction progress: 35500/43476 rows
Strong feature extraction progress: 35750/43476 rows
Strong feature extraction progress: 36000/43476 rows
Strong feature extraction progress: 36250/43476 rows
Strong feature extraction progress: 36500/43476 rows
Strong feature extraction progress: 36750/43476 rows
Strong feature extraction progress: 37000/43476 rows
Strong feature extraction progress: 37250/43476 rows
Strong feature extraction progress: 37500/43476 rows
Strong feature extraction progress: 37750/43476 rows
Strong feature extraction progress: 38000/43476 rows
Strong feature extraction progress: 38250/43476 rows
Strong feature extraction progress: 38500/43476 rows
Strong feature extraction progress: 38750/43476 rows
Strong feature extraction progress: 39000/43476 rows
Strong feature extraction progress: 39250/43476 rows
Strong feature extraction progress: 39500/43476 rows
Strong feature extraction progress: 39750/43476 rows
Strong feature extraction progress: 40000/43476 rows
Strong feature extraction progress: 40250/43476 rows
Strong feature extraction progress: 40500/43476 rows
Strong feature extraction progress: 40750/43476 rows
Strong feature extraction progress: 41000/43476 rows
Strong feature extraction progress: 41250/43476 rows
Strong feature extraction progress: 41500/43476 rows
Strong feature extraction progress: 41750/43476 rows
Strong feature extraction progress: 42000/43476 rows
Strong feature extraction progress: 42250/43476 rows
Strong feature extraction progress: 42500/43476 rows
Strong feature extraction progress: 42750/43476 rows
Strong feature extraction progress: 43000/43476 rows
Strong feature extraction progress: 43250/43476 rows
Strong feature extraction progress: 43476/43476 rows
Wrote strong acoustic features: data/processed/features_strong_acoustic_aug2_quality.csv (43476 rows, 2188 columns)
/home/covid/Desktop/Covid-19-BTP/covid_audio_btp/.venv/lib/python3.12/site-packages/sklearn/utils/validation.py:2827: UserWarning: X does not have valid feature names, but LGBMClassifier was fitted with feature names
  warnings.warn(
/home/covid/Desktop/Covid-19-BTP/covid_audio_btp/.venv/lib/python3.12/site-packages/sklearn/utils/validation.py:2827: UserWarning: X does not have valid feature names, but LGBMClassifier was fitted with feature names
  warnings.warn(
[I 2026-06-19 18:01:18,032] A new study created in memory with name: no-name-1127e253-cdd5-47cf-ac03-131e0efaa2bc
[I 2026-06-19 18:01:19,056] Trial 0 finished with value: 0.7236407660136475 and parameters: {'family': 'extra_trees', 'percentile': 80, 'n_estimators': 400, 'min_samples_leaf': 1, 'max_depth': '4'}. Best is trial 0 with value: 0.7236407660136475.
[I 2026-06-19 18:01:21,929] Trial 1 finished with value: 0.7319502531366939 and parameters: {'family': 'logistic', 'percentile': 50, 'logistic_c': 0.0066240595682091315}. Best is trial 1 with value: 0.7319502531366939.
[I 2026-06-19 18:01:24,291] Trial 2 finished with value: 0.757361753124465 and parameters: {'family': 'extra_trees', 'percentile': 60, 'n_estimators': 700, 'min_samples_leaf': 1, 'max_depth': '12'}. Best is trial 2 with value: 0.757361753124465.
[I 2026-06-19 18:01:25,329] Trial 3 finished with value: 0.7236407660136475 and parameters: {'family': 'extra_trees', 'percentile': 80, 'n_estimators': 400, 'min_samples_leaf': 1, 'max_depth': '4'}. Best is trial 2 with value: 0.757361753124465.
[I 2026-06-19 18:01:27,474] Trial 4 finished with value: 0.745194071465258 and parameters: {'family': 'logistic', 'percentile': 70, 'logistic_c': 0.0014254814784217286}. Best is trial 2 with value: 0.757361753124465.
[I 2026-06-19 18:01:36,437] Trial 5 finished with value: 0.7106720962653166 and parameters: {'family': 'logistic', 'percentile': 60, 'logistic_c': 0.21301372721189435}. Best is trial 2 with value: 0.757361753124465.
[I 2026-06-19 18:01:42,412] Trial 6 finished with value: 0.7542434025484873 and parameters: {'family': 'random_forest', 'percentile': 90, 'n_estimators': 1000, 'min_samples_leaf': 5, 'max_depth': '4'}. Best is trial 2 with value: 0.757361753124465.
[I 2026-06-19 18:01:44,822] Trial 7 finished with value: 0.7539865972069362 and parameters: {'family': 'extra_trees', 'percentile': 90, 'n_estimators': 500, 'min_samples_leaf': 2, 'max_depth': '16'}. Best is trial 2 with value: 0.757361753124465.
[I 2026-06-19 18:02:05,922] Trial 8 finished with value: 0.7183028835571208 and parameters: {'family': 'logistic', 'percentile': 90, 'logistic_c': 1.4611205138065535}. Best is trial 2 with value: 0.757361753124465.
[I 2026-06-19 18:02:07,299] Trial 9 finished with value: 0.7496698217037199 and parameters: {'family': 'extra_trees', 'percentile': 60, 'n_estimators': 300, 'min_samples_leaf': 5, 'max_depth': 'none'}. Best is trial 2 with value: 0.757361753124465.
[I 2026-06-19 18:02:13,780] Trial 10 finished with value: 0.7611098882285323 and parameters: {'family': 'random_forest', 'percentile': 40, 'n_estimators': 800, 'min_samples_leaf': 3, 'max_depth': '12'}. Best is trial 10 with value: 0.7611098882285323.
[I 2026-06-19 18:02:20,284] Trial 11 finished with value: 0.7611098882285323 and parameters: {'family': 'random_forest', 'percentile': 40, 'n_estimators': 800, 'min_samples_leaf': 3, 'max_depth': '12'}. Best is trial 10 with value: 0.7611098882285323.
[I 2026-06-19 18:02:26,898] Trial 12 finished with value: 0.7611098882285323 and parameters: {'family': 'random_forest', 'percentile': 40, 'n_estimators': 800, 'min_samples_leaf': 3, 'max_depth': '12'}. Best is trial 10 with value: 0.7611098882285323.
[I 2026-06-19 18:02:32,418] Trial 13 finished with value: 0.7627485508841441 and parameters: {'family': 'random_forest', 'percentile': 40, 'n_estimators': 800, 'min_samples_leaf': 3, 'max_depth': '8'}. Best is trial 13 with value: 0.7627485508841441.
[I 2026-06-19 18:02:39,171] Trial 14 finished with value: 0.7631398733093648 and parameters: {'family': 'random_forest', 'percentile': 40, 'n_estimators': 1000, 'min_samples_leaf': 3, 'max_depth': '8'}. Best is trial 14 with value: 0.7631398733093648.
[I 2026-06-19 18:02:46,268] Trial 15 finished with value: 0.7670469831486779 and parameters: {'family': 'random_forest', 'percentile': 50, 'n_estimators': 1000, 'min_samples_leaf': 4, 'max_depth': '8'}. Best is trial 15 with value: 0.7670469831486779.
[I 2026-06-19 18:02:53,498] Trial 16 finished with value: 0.7670469831486779 and parameters: {'family': 'random_forest', 'percentile': 50, 'n_estimators': 1000, 'min_samples_leaf': 4, 'max_depth': '8'}. Best is trial 15 with value: 0.7670469831486779.
[I 2026-06-19 18:03:00,607] Trial 17 finished with value: 0.7670469831486779 and parameters: {'family': 'random_forest', 'percentile': 50, 'n_estimators': 1000, 'min_samples_leaf': 4, 'max_depth': '8'}. Best is trial 15 with value: 0.7670469831486779.
[I 2026-06-19 18:03:07,075] Trial 18 finished with value: 0.7669369237165847 and parameters: {'family': 'random_forest', 'percentile': 50, 'n_estimators': 900, 'min_samples_leaf': 4, 'max_depth': '8'}. Best is trial 15 with value: 0.7670469831486779.
[I 2026-06-19 18:03:14,404] Trial 19 finished with value: 0.765059798958104 and parameters: {'family': 'random_forest', 'percentile': 70, 'n_estimators': 900, 'min_samples_leaf': 4, 'max_depth': '8'}. Best is trial 15 with value: 0.7670469831486779.
[I 2026-06-19 18:03:22,617] Trial 20 finished with value: 0.7624306014136522 and parameters: {'family': 'random_forest', 'percentile': 50, 'n_estimators': 900, 'min_samples_leaf': 5, 'max_depth': '16'}. Best is trial 15 with value: 0.7670469831486779.
[I 2026-06-19 18:03:29,728] Trial 21 finished with value: 0.7670469831486779 and parameters: {'family': 'random_forest', 'percentile': 50, 'n_estimators': 1000, 'min_samples_leaf': 4, 'max_depth': '8'}. Best is trial 15 with value: 0.7670469831486779.
[I 2026-06-19 18:03:37,427] Trial 22 finished with value: 0.7665884021816225 and parameters: {'family': 'random_forest', 'percentile': 60, 'n_estimators': 1000, 'min_samples_leaf': 4, 'max_depth': '8'}. Best is trial 15 with value: 0.7670469831486779.
[I 2026-06-19 18:03:43,898] Trial 23 finished with value: 0.7669369237165847 and parameters: {'family': 'random_forest', 'percentile': 50, 'n_estimators': 900, 'min_samples_leaf': 4, 'max_depth': '8'}. Best is trial 15 with value: 0.7670469831486779.
[I 2026-06-19 18:03:52,017] Trial 24 finished with value: 0.7651392863257269 and parameters: {'family': 'random_forest', 'percentile': 70, 'n_estimators': 1000, 'min_samples_leaf': 4, 'max_depth': '8'}. Best is trial 15 with value: 0.7670469831486779.
[I 2026-06-19 18:04:00,347] Trial 25 finished with value: 0.7628096950130848 and parameters: {'family': 'random_forest', 'percentile': 50, 'n_estimators': 900, 'min_samples_leaf': 5, 'max_depth': 'none'}. Best is trial 15 with value: 0.7670469831486779.
[I 2026-06-19 18:04:06,857] Trial 26 finished with value: 0.7623755716976056 and parameters: {'family': 'random_forest', 'percentile': 100, 'n_estimators': 700, 'min_samples_leaf': 4, 'max_depth': '8'}. Best is trial 15 with value: 0.7670469831486779.
[I 2026-06-19 18:04:14,564] Trial 27 finished with value: 0.7648519089197056 and parameters: {'family': 'random_forest', 'percentile': 60, 'n_estimators': 1000, 'min_samples_leaf': 2, 'max_depth': '8'}. Best is trial 15 with value: 0.7670469831486779.
[I 2026-06-19 18:04:20,965] Trial 28 finished with value: 0.767205957883924 and parameters: {'family': 'random_forest', 'percentile': 50, 'n_estimators': 900, 'min_samples_leaf': 5, 'max_depth': '8'}. Best is trial 28 with value: 0.767205957883924.
[I 2026-06-19 18:04:52,084] Trial 29 finished with value: 0.7025276982904102 and parameters: {'family': 'logistic', 'percentile': 60, 'logistic_c': 24.743303275607825}. Best is trial 28 with value: 0.767205957883924.
[I 2026-06-19 18:04:54,844] Trial 30 finished with value: 0.75016508914814 and parameters: {'family': 'extra_trees', 'percentile': 70, 'n_estimators': 700, 'min_samples_leaf': 5, 'max_depth': '16'}. Best is trial 28 with value: 0.767205957883924.
[I 2026-06-19 18:05:01,219] Trial 31 finished with value: 0.767205957883924 and parameters: {'family': 'random_forest', 'percentile': 50, 'n_estimators': 900, 'min_samples_leaf': 5, 'max_depth': '8'}. Best is trial 28 with value: 0.767205957883924.
[I 2026-06-19 18:05:07,566] Trial 32 finished with value: 0.767205957883924 and parameters: {'family': 'random_forest', 'percentile': 50, 'n_estimators': 900, 'min_samples_leaf': 5, 'max_depth': '8'}. Best is trial 28 with value: 0.767205957883924.
[I 2026-06-19 18:05:13,536] Trial 33 finished with value: 0.7676156235478269 and parameters: {'family': 'random_forest', 'percentile': 40, 'n_estimators': 900, 'min_samples_leaf': 5, 'max_depth': '8'}. Best is trial 33 with value: 0.7676156235478269.
[I 2026-06-19 18:05:18,945] Trial 34 finished with value: 0.7674811064641573 and parameters: {'family': 'random_forest', 'percentile': 40, 'n_estimators': 800, 'min_samples_leaf': 5, 'max_depth': '8'}. Best is trial 33 with value: 0.7676156235478269.
[I 2026-06-19 18:05:22,510] Trial 35 finished with value: 0.7122006994888351 and parameters: {'family': 'logistic', 'percentile': 40, 'logistic_c': 0.04150000647701572}. Best is trial 33 with value: 0.7676156235478269.
[I 2026-06-19 18:05:24,514] Trial 36 finished with value: 0.7509293907598992 and parameters: {'family': 'extra_trees', 'percentile': 40, 'n_estimators': 600, 'min_samples_leaf': 5, 'max_depth': 'none'}. Best is trial 33 with value: 0.7676156235478269.
[I 2026-06-19 18:05:28,721] Trial 37 finished with value: 0.7534668721109399 and parameters: {'family': 'random_forest', 'percentile': 40, 'n_estimators': 800, 'min_samples_leaf': 5, 'max_depth': '4'}. Best is trial 33 with value: 0.7676156235478269.
[I 2026-06-19 18:05:33,486] Trial 38 finished with value: 0.7676523100251914 and parameters: {'family': 'random_forest', 'percentile': 40, 'n_estimators': 700, 'min_samples_leaf': 5, 'max_depth': '8'}. Best is trial 38 with value: 0.7676523100251914.
[I 2026-06-19 18:05:54,384] Trial 39 finished with value: 0.6887580404529557 and parameters: {'family': 'logistic', 'percentile': 40, 'logistic_c': 23.437573147053158}. Best is trial 38 with value: 0.7676523100251914.
[I 2026-06-19 18:05:55,973] Trial 40 finished with value: 0.7467899332306112 and parameters: {'family': 'extra_trees', 'percentile': 40, 'n_estimators': 600, 'min_samples_leaf': 5, 'max_depth': '8'}. Best is trial 38 with value: 0.7676523100251914.
[I 2026-06-19 18:06:01,072] Trial 41 finished with value: 0.7666434318976691 and parameters: {'family': 'random_forest', 'percentile': 50, 'n_estimators': 700, 'min_samples_leaf': 5, 'max_depth': '8'}. Best is trial 38 with value: 0.7676523100251914.
[I 2026-06-19 18:06:06,414] Trial 42 finished with value: 0.7674811064641573 and parameters: {'family': 'random_forest', 'percentile': 40, 'n_estimators': 800, 'min_samples_leaf': 5, 'max_depth': '8'}. Best is trial 38 with value: 0.7676523100251914.
[I 2026-06-19 18:06:09,636] Trial 43 finished with value: 0.7528676596473206 and parameters: {'family': 'random_forest', 'percentile': 40, 'n_estimators': 600, 'min_samples_leaf': 5, 'max_depth': '4'}. Best is trial 38 with value: 0.7676523100251914.
[I 2026-06-19 18:06:14,936] Trial 44 finished with value: 0.7674811064641573 and parameters: {'family': 'random_forest', 'percentile': 40, 'n_estimators': 800, 'min_samples_leaf': 5, 'max_depth': '8'}. Best is trial 38 with value: 0.7676523100251914.
[I 2026-06-19 18:06:20,820] Trial 45 finished with value: 0.7637757722503484 and parameters: {'family': 'random_forest', 'percentile': 40, 'n_estimators': 700, 'min_samples_leaf': 5, 'max_depth': '16'}. Best is trial 38 with value: 0.7676523100251914.
[I 2026-06-19 18:06:26,191] Trial 46 finished with value: 0.7674811064641573 and parameters: {'family': 'random_forest', 'percentile': 40, 'n_estimators': 800, 'min_samples_leaf': 5, 'max_depth': '8'}. Best is trial 38 with value: 0.7676523100251914.
[I 2026-06-19 18:06:37,841] Trial 47 finished with value: 0.6961687088805733 and parameters: {'family': 'logistic', 'percentile': 40, 'logistic_c': 1.164716737536578}. Best is trial 38 with value: 0.7676523100251914.
