[I 2026-06-19 18:42:26,939] Trial 36 finished with value: 0.7493866841047849 and parameters: {'family': 'extra_trees', 'percentile': 100, 'n_estimators': 900, 'min_samples_leaf': 4, 'max_depth': 'none'}. Best is trial 28 with value: 0.7558293285296253.
[I 2026-06-19 18:42:50,484] Trial 37 finished with value: 0.7493537819947316 and parameters: {'family': 'random_forest', 'percentile': 90, 'n_estimators': 800, 'min_samples_leaf': 5, 'max_depth': '12'}. Best is trial 28 with value: 0.7558293285296253.
[I 2026-06-19 18:43:09,341] Trial 38 finished with value: 0.7452718639662261 and parameters: {'family': 'random_forest', 'percentile': 80, 'n_estimators': 900, 'min_samples_leaf': 3, 'max_depth': '8'}. Best is trial 28 with value: 0.7558293285296253.
[I 2026-06-19 18:44:22,461] Trial 39 finished with value: 0.7102537369599684 and parameters: {'family': 'logistic', 'percentile': 100, 'logistic_c': 23.437573147053158}. Best is trial 28 with value: 0.7558293285296253.
[I 2026-06-19 18:44:25,546] Trial 40 finished with value: 0.6942427476552107 and parameters: {'family': 'extra_trees', 'percentile': 60, 'n_estimators': 1000, 'min_samples_leaf': 4, 'max_depth': '4'}. Best is trial 28 with value: 0.7558293285296253.
[I 2026-06-19 18:44:59,867] Trial 41 finished with value: 0.7550571571343085 and parameters: {'family': 'random_forest', 'percentile': 100, 'n_estimators': 900, 'min_samples_leaf': 4, 'max_depth': 'none'}. Best is trial 28 with value: 0.7558293285296253.
[I 2026-06-19 18:45:32,505] Trial 42 finished with value: 0.755471518082794 and parameters: {'family': 'random_forest', 'percentile': 90, 'n_estimators': 900, 'min_samples_leaf': 4, 'max_depth': 'none'}. Best is trial 28 with value: 0.7558293285296253.
[I 2026-06-19 18:46:09,698] Trial 43 finished with value: 0.7546695291502413 and parameters: {'family': 'random_forest', 'percentile': 90, 'n_estimators': 1000, 'min_samples_leaf': 4, 'max_depth': 'none'}. Best is trial 28 with value: 0.7558293285296253.
[I 2026-06-19 18:46:39,061] Trial 44 finished with value: 0.756129560283863 and parameters: {'family': 'random_forest', 'percentile': 90, 'n_estimators': 800, 'min_samples_leaf': 5, 'max_depth': 'none'}. Best is trial 44 with value: 0.756129560283863.
[I 2026-06-19 18:46:49,686] Trial 45 finished with value: 0.7191290811468853 and parameters: {'family': 'random_forest', 'percentile': 90, 'n_estimators': 800, 'min_samples_leaf': 5, 'max_depth': '4'}. Best is trial 44 with value: 0.756129560283863.
[I 2026-06-19 18:47:11,753] Trial 46 finished with value: 0.7511263831738609 and parameters: {'family': 'random_forest', 'percentile': 80, 'n_estimators': 800, 'min_samples_leaf': 5, 'max_depth': '12'}. Best is trial 44 with value: 0.756129560283863.
[I 2026-06-19 18:48:02,275] Trial 47 finished with value: 0.7097170212897216 and parameters: {'family': 'logistic', 'percentile': 90, 'logistic_c': 1.164716737536578}. Best is trial 44 with value: 0.756129560283863.
[I 2026-06-19 18:48:21,413] Trial 48 finished with value: 0.7519633305983454 and parameters: {'family': 'random_forest', 'percentile': 70, 'n_estimators': 600, 'min_samples_leaf': 5, 'max_depth': 'none'}. Best is trial 44 with value: 0.756129560283863.
[I 2026-06-19 18:48:29,841] Trial 49 finished with value: 0.7508199822739883 and parameters: {'family': 'extra_trees', 'percentile': 60, 'n_estimators': 800, 'min_samples_leaf': 5, 'max_depth': 'none'}. Best is trial 44 with value: 0.756129560283863.
/home/covid/Desktop/Covid-19-BTP/covid_audio_btp/.venv/lib/python3.12/site-packages/sklearn/utils/validation.py:2827: UserWarning: X does not have valid feature names, but LGBMClassifier was fitted with feature names
  warnings.warn(
/home/covid/Desktop/Covid-19-BTP/covid_audio_btp/.venv/lib/python3.12/site-packages/sklearn/utils/validation.py:2827: UserWarning: X does not have valid feature names, but LGBMClassifier was fitted with feature names
  warnings.warn(
[I 2026-06-19 18:52:15,231] A new study created in memory with name: no-name-87863397-ab09-404d-a451-32908ad82927
[I 2026-06-19 18:52:16,010] Trial 0 finished with value: 0.6993006993006993 and parameters: {'family': 'extra_trees', 'percentile': 80, 'n_estimators': 400, 'min_samples_leaf': 1, 'max_depth': '4'}. Best is trial 0 with value: 0.6993006993006993.
[I 2026-06-19 18:52:17,066] Trial 1 finished with value: 0.7878302253302252 and parameters: {'family': 'logistic', 'percentile': 50, 'logistic_c': 0.0066240595682091315}. Best is trial 1 with value: 0.7878302253302252.
[I 2026-06-19 18:52:18,486] Trial 2 finished with value: 0.7324203574203575 and parameters: {'family': 'extra_trees', 'percentile': 60, 'n_estimators': 700, 'min_samples_leaf': 1, 'max_depth': '12'}. Best is trial 1 with value: 0.7878302253302252.
[I 2026-06-19 18:52:19,239] Trial 3 finished with value: 0.6993006993006993 and parameters: {'family': 'extra_trees', 'percentile': 80, 'n_estimators': 400, 'min_samples_leaf': 1, 'max_depth': '4'}. Best is trial 1 with value: 0.7878302253302252.
[I 2026-06-19 18:52:20,595] Trial 4 finished with value: 0.808954933954934 and parameters: {'family': 'logistic', 'percentile': 70, 'logistic_c': 0.0014254814784217286}. Best is trial 4 with value: 0.808954933954934.
[I 2026-06-19 18:52:24,631] Trial 5 finished with value: 0.7596153846153846 and parameters: {'family': 'logistic', 'percentile': 60, 'logistic_c': 0.21301372721189435}. Best is trial 4 with value: 0.808954933954934.
[I 2026-06-19 18:52:28,131] Trial 6 finished with value: 0.7208139083139083 and parameters: {'family': 'random_forest', 'percentile': 90, 'n_estimators': 1000, 'min_samples_leaf': 5, 'max_depth': '4'}. Best is trial 4 with value: 0.808954933954934.
[I 2026-06-19 18:52:29,185] Trial 7 finished with value: 0.7338772338772339 and parameters: {'family': 'extra_trees', 'percentile': 90, 'n_estimators': 500, 'min_samples_leaf': 2, 'max_depth': '16'}. Best is trial 4 with value: 0.808954933954934.
[I 2026-06-19 18:52:33,844] Trial 8 finished with value: 0.7677253302253303 and parameters: {'family': 'logistic', 'percentile': 90, 'logistic_c': 1.4611205138065535}. Best is trial 4 with value: 0.808954933954934.
[I 2026-06-19 18:52:34,560] Trial 9 finished with value: 0.7324689199689199 and parameters: {'family': 'extra_trees', 'percentile': 60, 'n_estimators': 300, 'min_samples_leaf': 5, 'max_depth': 'none'}. Best is trial 4 with value: 0.808954933954934.
[I 2026-06-19 18:52:38,210] Trial 10 finished with value: 0.7365967365967366 and parameters: {'family': 'random_forest', 'percentile': 40, 'n_estimators': 1000, 'min_samples_leaf': 3, 'max_depth': '8'}. Best is trial 4 with value: 0.808954933954934.
[I 2026-06-19 18:52:39,582] Trial 11 finished with value: 0.7767094017094016 and parameters: {'family': 'logistic', 'percentile': 40, 'logistic_c': 0.0011234362079909188}. Best is trial 4 with value: 0.808954933954934.
[I 2026-06-19 18:52:41,149] Trial 12 finished with value: 0.7871989121989121 and parameters: {'family': 'logistic', 'percentile': 50, 'logistic_c': 0.0017164142601062626}. Best is trial 4 with value: 0.808954933954934.
[I 2026-06-19 18:52:42,901] Trial 13 finished with value: 0.7964257964257965 and parameters: {'family': 'logistic', 'percentile': 70, 'logistic_c': 0.020341690646828656}. Best is trial 4 with value: 0.808954933954934.
[I 2026-06-19 18:52:44,666] Trial 14 finished with value: 0.7899669774669774 and parameters: {'family': 'logistic', 'percentile': 70, 'logistic_c': 0.03458075594417433}. Best is trial 4 with value: 0.808954933954934.
[I 2026-06-19 18:52:46,218] Trial 15 finished with value: 0.7945318570318571 and parameters: {'family': 'logistic', 'percentile': 70, 'logistic_c': 0.023754966069769793}. Best is trial 4 with value: 0.808954933954934.
[I 2026-06-19 18:52:50,904] Trial 16 finished with value: 0.7651029526029527 and parameters: {'family': 'logistic', 'percentile': 100, 'logistic_c': 21.275872228626255}. Best is trial 4 with value: 0.808954933954934.
[I 2026-06-19 18:52:53,929] Trial 17 finished with value: 0.7383935508935509 and parameters: {'family': 'random_forest', 'percentile': 70, 'n_estimators': 700, 'min_samples_leaf': 3, 'max_depth': 'none'}. Best is trial 4 with value: 0.808954933954934.
[I 2026-06-19 18:52:56,617] Trial 18 finished with value: 0.7978341103341103 and parameters: {'family': 'logistic', 'percentile': 80, 'logistic_c': 0.01425368592272892}. Best is trial 4 with value: 0.808954933954934.
[I 2026-06-19 18:52:58,255] Trial 19 finished with value: 0.8068181818181819 and parameters: {'family': 'logistic', 'percentile': 80, 'logistic_c': 0.00564458917941432}. Best is trial 4 with value: 0.808954933954934.
[I 2026-06-19 18:53:01,802] Trial 20 finished with value: 0.7328088578088578 and parameters: {'family': 'random_forest', 'percentile': 100, 'n_estimators': 800, 'min_samples_leaf': 4, 'max_depth': '16'}. Best is trial 4 with value: 0.808954933954934.
[I 2026-06-19 18:53:03,834] Trial 21 finished with value: 0.81002331002331 and parameters: {'family': 'logistic', 'percentile': 80, 'logistic_c': 0.004429547605570954}. Best is trial 21 with value: 0.81002331002331.
[I 2026-06-19 18:53:05,818] Trial 22 finished with value: 0.8098290598290598 and parameters: {'family': 'logistic', 'percentile': 80, 'logistic_c': 0.004240477077931635}. Best is trial 21 with value: 0.81002331002331.
[I 2026-06-19 18:53:06,940] Trial 23 finished with value: 0.808517871017871 and parameters: {'family': 'logistic', 'percentile': 90, 'logistic_c': 0.002665905578068932}. Best is trial 21 with value: 0.81002331002331.
[I 2026-06-19 18:53:09,107] Trial 24 finished with value: 0.7811771561771562 and parameters: {'family': 'logistic', 'percentile': 80, 'logistic_c': 0.07215668891446772}. Best is trial 21 with value: 0.81002331002331.
[I 2026-06-19 18:53:10,883] Trial 25 finished with value: 0.8122086247086246 and parameters: {'family': 'logistic', 'percentile': 70, 'logistic_c': 0.0042650342829910655}. Best is trial 25 with value: 0.8122086247086246.
[I 2026-06-19 18:53:13,114] Trial 26 finished with value: 0.8082264957264959 and parameters: {'family': 'logistic', 'percentile': 80, 'logistic_c': 0.005328930404881081}. Best is trial 25 with value: 0.8122086247086246.
[I 2026-06-19 18:53:16,620] Trial 27 finished with value: 0.7620920745920745 and parameters: {'family': 'logistic', 'percentile': 60, 'logistic_c': 0.15443548251989522}. Best is trial 25 with value: 0.8122086247086246.
[I 2026-06-19 18:53:19,081] Trial 28 finished with value: 0.8010392385392385 and parameters: {'family': 'logistic', 'percentile': 90, 'logistic_c': 0.006096709497483222}. Best is trial 25 with value: 0.8122086247086246.
[I 2026-06-19 18:53:21,747] Trial 29 finished with value: 0.7371794871794872 and parameters: {'family': 'random_forest', 'percentile': 80, 'n_estimators': 600, 'min_samples_leaf': 3, 'max_depth': '8'}. Best is trial 25 with value: 0.8122086247086246.
[I 2026-06-19 18:53:23,490] Trial 30 finished with value: 0.7292152292152292 and parameters: {'family': 'extra_trees', 'percentile': 70, 'n_estimators': 900, 'min_samples_leaf': 4, 'max_depth': '12'}. Best is trial 25 with value: 0.8122086247086246.
[I 2026-06-19 18:53:24,541] Trial 31 finished with value: 0.8036130536130537 and parameters: {'family': 'logistic', 'percentile': 70, 'logistic_c': 0.0010016734574392731}. Best is trial 25 with value: 0.8122086247086246.
[I 2026-06-19 18:53:25,954] Trial 32 finished with value: 0.8125971250971252 and parameters: {'family': 'logistic', 'percentile': 70, 'logistic_c': 0.0027723784004905763}. Best is trial 32 with value: 0.8125971250971252.
[I 2026-06-19 18:53:27,234] Trial 33 finished with value: 0.7996794871794872 and parameters: {'family': 'logistic', 'percentile': 60, 'logistic_c': 0.0034331950021364503}. Best is trial 32 with value: 0.8125971250971252.
[I 2026-06-19 18:53:29,770] Trial 34 finished with value: 0.8022047397047398 and parameters: {'family': 'logistic', 'percentile': 80, 'logistic_c': 0.009590848014522074}. Best is trial 32 with value: 0.8125971250971252.
[I 2026-06-19 18:53:31,188] Trial 35 finished with value: 0.7898212898212899 and parameters: {'family': 'logistic', 'percentile': 50, 'logistic_c': 0.0028251404496345877}. Best is trial 32 with value: 0.8125971250971252.
[I 2026-06-19 18:53:31,976] Trial 36 finished with value: 0.730963480963481 and parameters: {'family': 'extra_trees', 'percentile': 80, 'n_estimators': 300, 'min_samples_leaf': 2, 'max_depth': '16'}. Best is trial 32 with value: 0.8125971250971252.
[I 2026-06-19 18:53:33,500] Trial 37 finished with value: 0.79249222999223 and parameters: {'family': 'logistic', 'percentile': 60, 'logistic_c': 0.012635608898935743}. Best is trial 32 with value: 0.8125971250971252.
[I 2026-06-19 18:53:36,862] Trial 38 finished with value: 0.7868589743589742 and parameters: {'family': 'logistic', 'percentile': 70, 'logistic_c': 0.045646380457280984}. Best is trial 32 with value: 0.8125971250971252.
[I 2026-06-19 18:53:37,942] Trial 39 finished with value: 0.808517871017871 and parameters: {'family': 'logistic', 'percentile': 90, 'logistic_c': 0.0026778379319974802}. Best is trial 32 with value: 0.8125971250971252.
[I 2026-06-19 18:53:39,546] Trial 40 finished with value: 0.7282439782439782 and parameters: {'family': 'extra_trees', 'percentile': 80, 'n_estimators': 800, 'min_samples_leaf': 4, 'max_depth': '12'}. Best is trial 32 with value: 0.8125971250971252.
[I 2026-06-19 18:53:41,464] Trial 41 finished with value: 0.8110916860916861 and parameters: {'family': 'logistic', 'percentile': 70, 'logistic_c': 0.0018369735427059245}. Best is trial 32 with value: 0.8125971250971252.
[I 2026-06-19 18:53:43,419] Trial 42 finished with value: 0.8126942501942502 and parameters: {'family': 'logistic', 'percentile': 70, 'logistic_c': 0.003301814394965686}. Best is trial 42 with value: 0.8126942501942502.
[I 2026-06-19 18:53:44,916] Trial 43 finished with value: 0.7974941724941724 and parameters: {'family': 'logistic', 'percentile': 60, 'logistic_c': 0.001933135055148289}. Best is trial 42 with value: 0.8126942501942502.
[I 2026-06-19 18:53:47,539] Trial 44 finished with value: 0.8074980574980574 and parameters: {'family': 'logistic', 'percentile': 70, 'logistic_c': 0.007783399109127626}. Best is trial 42 with value: 0.8126942501942502.
[I 2026-06-19 18:53:49,418] Trial 45 finished with value: 0.7953574203574204 and parameters: {'family': 'logistic', 'percentile': 60, 'logistic_c': 0.009109049161838766}. Best is trial 42 with value: 0.8126942501942502.
[I 2026-06-19 18:53:52,020] Trial 46 finished with value: 0.7373737373737373 and parameters: {'family': 'random_forest', 'percentile': 70, 'n_estimators': 600, 'min_samples_leaf': 2, 'max_depth': 'none'}. Best is trial 42 with value: 0.8126942501942502.
[I 2026-06-19 18:53:53,908] Trial 47 finished with value: 0.8110916860916861 and parameters: {'family': 'logistic', 'percentile': 70, 'logistic_c': 0.00190954934924786}. Best is trial 42 with value: 0.8126942501942502.
[I 2026-06-19 18:53:54,976] Trial 48 finished with value: 0.7264471639471639 and parameters: {'family': 'extra_trees', 'percentile': 60, 'n_estimators': 500, 'min_samples_leaf': 5, 'max_depth': '8'}. Best is trial 42 with value: 0.8126942501942502.
[I 2026-06-19 18:53:56,598] Trial 49 finished with value: 0.7869075369075369 and parameters: {'family': 'logistic', 'percentile': 50, 'logistic_c': 0.0016542743763017789}. Best is trial 42 with value: 0.8126942501942502.
/home/covid/Desktop/Covid-19-BTP/covid_audio_btp/.venv/lib/python3.12/site-packages/sklearn/utils/validation.py:2827: UserWarning: X does not have valid feature names, but LGBMClassifier was fitted with feature names
  warnings.warn(
/home/covid/Desktop/Covid-19-BTP/covid_audio_btp/.venv/lib/python3.12/site-packages/sklearn/utils/validation.py:2827: UserWarning: X does not have valid feature names, but LGBMClassifier was fitted with feature names
  warnings.warn(
[I 2026-06-19 18:56:50,643] A new study created in memory with name: no-name-2aadff55-b065-4133-8293-d82c27680ec0
[I 2026-06-19 18:56:51,399] Trial 0 finished with value: 0.7567388317779147 and parameters: {'family': 'extra_trees', 'percentile': 80, 'n_estimators': 400, 'min_samples_leaf': 1, 'max_depth': '4'}. Best is trial 0 with value: 0.7567388317779147.
[I 2026-06-19 18:56:52,625] Trial 1 finished with value: 0.7757828414420389 and parameters: {'family': 'logistic', 'percentile': 50, 'logistic_c': 0.0066240595682091315}. Best is trial 1 with value: 0.7757828414420389.
[I 2026-06-19 18:56:54,017] Trial 2 finished with value: 0.7944952389975841 and parameters: {'family': 'extra_trees', 'percentile': 60, 'n_estimators': 700, 'min_samples_leaf': 1, 'max_depth': '12'}. Best is trial 2 with value: 0.7944952389975841.
[I 2026-06-19 18:56:54,738] Trial 3 finished with value: 0.7567388317779147 and parameters: {'family': 'extra_trees', 'percentile': 80, 'n_estimators': 400, 'min_samples_leaf': 1, 'max_depth': '4'}. Best is trial 2 with value: 0.7944952389975841.
[I 2026-06-19 18:56:55,567] Trial 4 finished with value: 0.8006537495854849 and parameters: {'family': 'logistic', 'percentile': 70, 'logistic_c': 0.0014254814784217286}. Best is trial 4 with value: 0.8006537495854849.
[I 2026-06-19 18:56:59,131] Trial 5 finished with value: 0.73523141787863 and parameters: {'family': 'logistic', 'percentile': 60, 'logistic_c': 0.21301372721189435}. Best is trial 4 with value: 0.8006537495854849.
[I 2026-06-19 18:57:02,581] Trial 6 finished with value: 0.7743142735326165 and parameters: {'family': 'random_forest', 'percentile': 90, 'n_estimators': 1000, 'min_samples_leaf': 5, 'max_depth': '4'}. Best is trial 4 with value: 0.8006537495854849.
[I 2026-06-19 18:57:03,620] Trial 7 finished with value: 0.7907053863281065 and parameters: {'family': 'extra_trees', 'percentile': 90, 'n_estimators': 500, 'min_samples_leaf': 2, 'max_depth': '16'}. Best is trial 4 with value: 0.8006537495854849.
[I 2026-06-19 18:57:08,981] Trial 8 finished with value: 0.7365104931545786 and parameters: {'family': 'logistic', 'percentile': 90, 'logistic_c': 1.4611205138065535}. Best is trial 4 with value: 0.8006537495854849.
[I 2026-06-19 18:57:09,692] Trial 9 finished with value: 0.7702875550712965 and parameters: {'family': 'extra_trees', 'percentile': 60, 'n_estimators': 300, 'min_samples_leaf': 5, 'max_depth': 'none'}. Best is trial 4 with value: 0.8006537495854849.
[I 2026-06-19 18:57:13,212] Trial 10 finished with value: 0.7821308446634138 and parameters: {'family': 'random_forest', 'percentile': 40, 'n_estimators': 1000, 'min_samples_leaf': 3, 'max_depth': '8'}. Best is trial 4 with value: 0.8006537495854849.
[I 2026-06-19 18:57:14,494] Trial 11 finished with value: 0.8013169738026436 and parameters: {'family': 'logistic', 'percentile': 70, 'logistic_c': 0.0011755327203465582}. Best is trial 11 with value: 0.8013169738026436.
[I 2026-06-19 18:57:15,653] Trial 12 finished with value: 0.8022170638116445 and parameters: {'family': 'logistic', 'percentile': 70, 'logistic_c': 0.0010936476616866374}. Best is trial 12 with value: 0.8022170638116445.
[I 2026-06-19 18:57:17,437] Trial 13 finished with value: 0.8007484959022217 and parameters: {'family': 'logistic', 'percentile': 70, 'logistic_c': 0.0013347383902959447}. Best is trial 12 with value: 0.8022170638116445.
[I 2026-06-19 18:57:20,028] Trial 14 finished with value: 0.7729404519399308 and parameters: {'family': 'logistic', 'percentile': 100, 'logistic_c': 0.018670863493121193}. Best is trial 12 with value: 0.8022170638116445.
[I 2026-06-19 18:57:21,218] Trial 15 finished with value: 0.8025486759202236 and parameters: {'family': 'logistic', 'percentile': 70, 'logistic_c': 0.001037188093555136}. Best is trial 15 with value: 0.8025486759202236.
[I 2026-06-19 18:57:22,561] Trial 16 finished with value: 0.7653133734426074 and parameters: {'family': 'logistic', 'percentile': 50, 'logistic_c': 0.011814145193153835}. Best is trial 15 with value: 0.8025486759202236.
[I 2026-06-19 18:57:27,478] Trial 17 finished with value: 0.796627031124165 and parameters: {'family': 'random_forest', 'percentile': 80, 'n_estimators': 700, 'min_samples_leaf': 3, 'max_depth': 'none'}. Best is trial 15 with value: 0.8025486759202236.
[I 2026-06-19 18:57:30,164] Trial 18 finished with value: 0.7452745274527454 and parameters: {'family': 'logistic', 'percentile': 70, 'logistic_c': 29.803468870872535}. Best is trial 15 with value: 0.8025486759202236.
[I 2026-06-19 18:57:33,210] Trial 19 finished with value: 0.7446586763939552 and parameters: {'family': 'logistic', 'percentile': 50, 'logistic_c': 0.038121053596231316}. Best is trial 15 with value: 0.8025486759202236.
[I 2026-06-19 18:57:36,169] Trial 20 finished with value: 0.7877682505092615 and parameters: {'family': 'random_forest', 'percentile': 40, 'n_estimators': 800, 'min_samples_leaf': 4, 'max_depth': '16'}. Best is trial 15 with value: 0.8025486759202236.
[I 2026-06-19 18:57:37,349] Trial 21 finished with value: 0.8022170638116444 and parameters: {'family': 'logistic', 'percentile': 70, 'logistic_c': 0.0010920912652891174}. Best is trial 15 with value: 0.8025486759202236.
[I 2026-06-19 18:57:39,023] Trial 22 finished with value: 0.7889999526268417 and parameters: {'family': 'logistic', 'percentile': 80, 'logistic_c': 0.0035403100552740207}. Best is trial 15 with value: 0.8025486759202236.
[I 2026-06-19 18:57:40,326] Trial 23 finished with value: 0.8015064664361173 and parameters: {'family': 'logistic', 'percentile': 60, 'logistic_c': 0.0010148408524692427}. Best is trial 15 with value: 0.8025486759202236.
[I 2026-06-19 18:57:42,397] Trial 24 finished with value: 0.792173954237529 and parameters: {'family': 'logistic', 'percentile': 70, 'logistic_c': 0.004775822617941798}. Best is trial 15 with value: 0.8025486759202236.
