[I 2026-06-19 18:06:44,151] Trial 48 finished with value: 0.76290752561939 and parameters: {'family': 'random_forest', 'percentile': 40, 'n_estimators': 800, 'min_samples_leaf': 5, 'max_depth': '12'}. Best is trial 38 with value: 0.7676523100251914.
[I 2026-06-19 18:06:46,363] Trial 49 finished with value: 0.7509660772372637 and parameters: {'family': 'extra_trees', 'percentile': 40, 'n_estimators': 700, 'min_samples_leaf': 5, 'max_depth': 'none'}. Best is trial 38 with value: 0.7676523100251914.
/home/covid/Desktop/Covid-19-BTP/covid_audio_btp/.venv/lib/python3.12/site-packages/sklearn/utils/validation.py:2827: UserWarning: X does not have valid feature names, but LGBMClassifier was fitted with feature names
  warnings.warn(
/home/covid/Desktop/Covid-19-BTP/covid_audio_btp/.venv/lib/python3.12/site-packages/sklearn/utils/validation.py:2827: UserWarning: X does not have valid feature names, but LGBMClassifier was fitted with feature names
  warnings.warn(
[I 2026-06-19 18:10:57,663] A new study created in memory with name: no-name-c7f37107-bb55-4d23-a66e-7a5c67fe3ed8
[I 2026-06-19 18:10:58,683] Trial 0 finished with value: 0.6775478947095166 and parameters: {'family': 'extra_trees', 'percentile': 80, 'n_estimators': 400, 'min_samples_leaf': 1, 'max_depth': '4'}. Best is trial 0 with value: 0.6775478947095166.
[I 2026-06-19 18:11:01,501] Trial 1 finished with value: 0.7209127251959919 and parameters: {'family': 'logistic', 'percentile': 50, 'logistic_c': 0.0066240595682091315}. Best is trial 1 with value: 0.7209127251959919.
[I 2026-06-19 18:11:03,867] Trial 2 finished with value: 0.712229375421837 and parameters: {'family': 'extra_trees', 'percentile': 60, 'n_estimators': 700, 'min_samples_leaf': 1, 'max_depth': '12'}. Best is trial 1 with value: 0.7209127251959919.
[I 2026-06-19 18:11:04,913] Trial 3 finished with value: 0.6775478947095166 and parameters: {'family': 'extra_trees', 'percentile': 80, 'n_estimators': 400, 'min_samples_leaf': 1, 'max_depth': '4'}. Best is trial 1 with value: 0.7209127251959919.
[I 2026-06-19 18:11:07,264] Trial 4 finished with value: 0.7300633404288458 and parameters: {'family': 'logistic', 'percentile': 70, 'logistic_c': 0.0014254814784217286}. Best is trial 4 with value: 0.7300633404288458.
[I 2026-06-19 18:11:16,150] Trial 5 finished with value: 0.6866725507502207 and parameters: {'family': 'logistic', 'percentile': 60, 'logistic_c': 0.21301372721189435}. Best is trial 4 with value: 0.7300633404288458.
[I 2026-06-19 18:11:22,190] Trial 6 finished with value: 0.6915918176626343 and parameters: {'family': 'random_forest', 'percentile': 90, 'n_estimators': 1000, 'min_samples_leaf': 5, 'max_depth': '4'}. Best is trial 4 with value: 0.7300633404288458.
[I 2026-06-19 18:11:24,558] Trial 7 finished with value: 0.7189528061886714 and parameters: {'family': 'extra_trees', 'percentile': 90, 'n_estimators': 500, 'min_samples_leaf': 2, 'max_depth': '16'}. Best is trial 4 with value: 0.7300633404288458.
[I 2026-06-19 18:11:42,945] Trial 8 finished with value: 0.6794818545246872 and parameters: {'family': 'logistic', 'percentile': 90, 'logistic_c': 1.4611205138065535}. Best is trial 4 with value: 0.7300633404288458.
[I 2026-06-19 18:11:44,271] Trial 9 finished with value: 0.7127355796687607 and parameters: {'family': 'extra_trees', 'percentile': 60, 'n_estimators': 300, 'min_samples_leaf': 5, 'max_depth': 'none'}. Best is trial 4 with value: 0.7300633404288458.
[I 2026-06-19 18:11:51,001] Trial 10 finished with value: 0.7087119048855199 and parameters: {'family': 'random_forest', 'percentile': 40, 'n_estimators': 1000, 'min_samples_leaf': 3, 'max_depth': '8'}. Best is trial 4 with value: 0.7300633404288458.
[I 2026-06-19 18:11:52,459] Trial 11 finished with value: 0.7137739473547584 and parameters: {'family': 'logistic', 'percentile': 40, 'logistic_c': 0.0011234362079909188}. Best is trial 4 with value: 0.7300633404288458.
[I 2026-06-19 18:11:54,348] Trial 12 finished with value: 0.7236254607756607 and parameters: {'family': 'logistic', 'percentile': 50, 'logistic_c': 0.0017164142601062626}. Best is trial 4 with value: 0.7300633404288458.
[I 2026-06-19 18:11:57,872] Trial 13 finished with value: 0.7257541145319557 and parameters: {'family': 'logistic', 'percentile': 70, 'logistic_c': 0.007014634703314543}. Best is trial 4 with value: 0.7300633404288458.
[I 2026-06-19 18:12:02,072] Trial 14 finished with value: 0.7128004776491356 and parameters: {'family': 'logistic', 'percentile': 70, 'logistic_c': 0.026077616621488192}. Best is trial 4 with value: 0.7300633404288458.
[I 2026-06-19 18:12:07,321] Trial 15 finished with value: 0.7093349254971186 and parameters: {'family': 'logistic', 'percentile': 70, 'logistic_c': 0.03681115883687551}. Best is trial 4 with value: 0.7300633404288458.
[I 2026-06-19 18:13:00,679] Trial 16 finished with value: 0.6646851149992212 and parameters: {'family': 'logistic', 'percentile': 100, 'logistic_c': 21.275872228626255}. Best is trial 4 with value: 0.7300633404288458.
[I 2026-06-19 18:13:09,167] Trial 17 finished with value: 0.7118919059238875 and parameters: {'family': 'random_forest', 'percentile': 70, 'n_estimators': 700, 'min_samples_leaf': 3, 'max_depth': 'none'}. Best is trial 4 with value: 0.7300633404288458.
[I 2026-06-19 18:13:12,571] Trial 18 finished with value: 0.7324905248948653 and parameters: {'family': 'logistic', 'percentile': 80, 'logistic_c': 0.009089148420062964}. Best is trial 18 with value: 0.7324905248948653.
[I 2026-06-19 18:13:15,900] Trial 19 finished with value: 0.733061627122164 and parameters: {'family': 'logistic', 'percentile': 80, 'logistic_c': 0.008597373643414891}. Best is trial 19 with value: 0.733061627122164.
[I 2026-06-19 18:13:26,364] Trial 20 finished with value: 0.7170837443538757 and parameters: {'family': 'random_forest', 'percentile': 100, 'n_estimators': 800, 'min_samples_leaf': 4, 'max_depth': '16'}. Best is trial 19 with value: 0.733061627122164.
[I 2026-06-19 18:13:30,188] Trial 21 finished with value: 0.7314910959970926 and parameters: {'family': 'logistic', 'percentile': 80, 'logistic_c': 0.010503968519871572}. Best is trial 19 with value: 0.733061627122164.
[I 2026-06-19 18:13:35,641] Trial 22 finished with value: 0.7200430922589689 and parameters: {'family': 'logistic', 'percentile': 80, 'logistic_c': 0.02732028051905765}. Best is trial 19 with value: 0.733061627122164.
[I 2026-06-19 18:13:38,921] Trial 23 finished with value: 0.734787913400135 and parameters: {'family': 'logistic', 'percentile': 80, 'logistic_c': 0.007030926024414986}. Best is trial 23 with value: 0.734787913400135.
[I 2026-06-19 18:13:49,462] Trial 24 finished with value: 0.6974196563002959 and parameters: {'family': 'logistic', 'percentile': 90, 'logistic_c': 0.1523863642625197}. Best is trial 23 with value: 0.734787913400135.
[I 2026-06-19 18:13:52,505] Trial 25 finished with value: 0.7365012200820309 and parameters: {'family': 'logistic', 'percentile': 80, 'logistic_c': 0.005734568942720136}. Best is trial 25 with value: 0.7365012200820309.
[I 2026-06-19 18:13:55,423] Trial 26 finished with value: 0.7395124863714242 and parameters: {'family': 'logistic', 'percentile': 90, 'logistic_c': 0.0037298269486411334}. Best is trial 26 with value: 0.7395124863714242.
[I 2026-06-19 18:13:59,052] Trial 27 finished with value: 0.7373059550386792 and parameters: {'family': 'logistic', 'percentile': 100, 'logistic_c': 0.003196735883667481}. Best is trial 26 with value: 0.7395124863714242.
[I 2026-06-19 18:14:01,694] Trial 28 finished with value: 0.7380198328228024 and parameters: {'family': 'logistic', 'percentile': 100, 'logistic_c': 0.0026699880027457094}. Best is trial 26 with value: 0.7395124863714242.
[I 2026-06-19 18:14:07,474] Trial 29 finished with value: 0.708244639426821 and parameters: {'family': 'random_forest', 'percentile': 100, 'n_estimators': 600, 'min_samples_leaf': 3, 'max_depth': '8'}. Best is trial 26 with value: 0.7395124863714242.
[I 2026-06-19 18:14:10,836] Trial 30 finished with value: 0.7134754166450341 and parameters: {'family': 'extra_trees', 'percentile': 100, 'n_estimators': 900, 'min_samples_leaf': 4, 'max_depth': '12'}. Best is trial 26 with value: 0.7395124863714242.
[I 2026-06-19 18:14:13,444] Trial 31 finished with value: 0.7408364051710711 and parameters: {'family': 'logistic', 'percentile': 90, 'logistic_c': 0.0026947098451988033}. Best is trial 31 with value: 0.7408364051710711.
[I 2026-06-19 18:14:16,077] Trial 32 finished with value: 0.7405508540574218 and parameters: {'family': 'logistic', 'percentile': 90, 'logistic_c': 0.003040491938633981}. Best is trial 31 with value: 0.7408364051710711.
[I 2026-06-19 18:14:18,701] Trial 33 finished with value: 0.7405897928456466 and parameters: {'family': 'logistic', 'percentile': 90, 'logistic_c': 0.0030704562573325837}. Best is trial 31 with value: 0.7408364051710711.
[I 2026-06-19 18:14:21,649] Trial 34 finished with value: 0.7405378744613468 and parameters: {'family': 'logistic', 'percentile': 90, 'logistic_c': 0.002872843858870913}. Best is trial 31 with value: 0.7408364051710711.
[I 2026-06-19 18:14:23,797] Trial 35 finished with value: 0.7408104459789211 and parameters: {'family': 'logistic', 'percentile': 90, 'logistic_c': 0.0011734651351346995}. Best is trial 31 with value: 0.7408364051710711.
[I 2026-06-19 18:14:25,404] Trial 36 finished with value: 0.7184855407299725 and parameters: {'family': 'extra_trees', 'percentile': 90, 'n_estimators': 300, 'min_samples_leaf': 2, 'max_depth': '16'}. Best is trial 31 with value: 0.7408364051710711.
[I 2026-06-19 18:14:27,699] Trial 37 finished with value: 0.7414464461865946 and parameters: {'family': 'logistic', 'percentile': 90, 'logistic_c': 0.0015282722258804658}. Best is trial 37 with value: 0.7414464461865946.
[I 2026-06-19 18:14:29,935] Trial 38 finished with value: 0.7405248948652718 and parameters: {'family': 'logistic', 'percentile': 90, 'logistic_c': 0.0010860303382730257}. Best is trial 37 with value: 0.7414464461865946.
[I 2026-06-19 18:14:32,019] Trial 39 finished with value: 0.7406546908260214 and parameters: {'family': 'logistic', 'percentile': 90, 'logistic_c': 0.0011036066875870912}. Best is trial 37 with value: 0.7414464461865946.
[I 2026-06-19 18:14:35,147] Trial 40 finished with value: 0.7133456206842843 and parameters: {'family': 'extra_trees', 'percentile': 100, 'n_estimators': 800, 'min_samples_leaf': 4, 'max_depth': '12'}. Best is trial 37 with value: 0.7414464461865946.
[I 2026-06-19 18:14:37,053] Trial 41 finished with value: 0.7405378744613468 and parameters: {'family': 'logistic', 'percentile': 90, 'logistic_c': 0.0011160776665918011}. Best is trial 37 with value: 0.7414464461865946.
[I 2026-06-19 18:14:39,507] Trial 42 finished with value: 0.7411998338611702 and parameters: {'family': 'logistic', 'percentile': 90, 'logistic_c': 0.0020851778315275483}. Best is trial 37 with value: 0.7414464461865946.
[I 2026-06-19 18:14:41,982] Trial 43 finished with value: 0.7415113441669695 and parameters: {'family': 'logistic', 'percentile': 90, 'logistic_c': 0.001893692224105747}. Best is trial 43 with value: 0.7415113441669695.
[I 2026-06-19 18:14:46,386] Trial 44 finished with value: 0.7253387674575568 and parameters: {'family': 'logistic', 'percentile': 80, 'logistic_c': 0.018220920177529805}. Best is trial 43 with value: 0.7415113441669695.
[I 2026-06-19 18:14:48,646] Trial 45 finished with value: 0.7414334665905196 and parameters: {'family': 'logistic', 'percentile': 90, 'logistic_c': 0.0019175117076311993}. Best is trial 43 with value: 0.7415113441669695.
[I 2026-06-19 18:14:57,600] Trial 46 finished with value: 0.712605783708011 and parameters: {'family': 'random_forest', 'percentile': 100, 'n_estimators': 600, 'min_samples_leaf': 2, 'max_depth': 'none'}. Best is trial 43 with value: 0.7415113441669695.
[I 2026-06-19 18:15:00,059] Trial 47 finished with value: 0.7407195888063963 and parameters: {'family': 'logistic', 'percentile': 90, 'logistic_c': 0.0025781557762274104}. Best is trial 43 with value: 0.7415113441669695.
[I 2026-06-19 18:15:01,612] Trial 48 finished with value: 0.6981724728726443 and parameters: {'family': 'extra_trees', 'percentile': 80, 'n_estimators': 500, 'min_samples_leaf': 5, 'max_depth': '8'}. Best is trial 43 with value: 0.7415113441669695.
[I 2026-06-19 18:15:04,892] Trial 49 finished with value: 0.7383443227246768 and parameters: {'family': 'logistic', 'percentile': 90, 'logistic_c': 0.004807104800471616}. Best is trial 43 with value: 0.7415113441669695.
/home/covid/Desktop/Covid-19-BTP/covid_audio_btp/.venv/lib/python3.12/site-packages/sklearn/utils/validation.py:2827: UserWarning: X does not have valid feature names, but LGBMClassifier was fitted with feature names
  warnings.warn(
/home/covid/Desktop/Covid-19-BTP/covid_audio_btp/.venv/lib/python3.12/site-packages/sklearn/utils/validation.py:2827: UserWarning: X does not have valid feature names, but LGBMClassifier was fitted with feature names
  warnings.warn(
[I 2026-06-19 18:28:49,006] A new study created in memory with name: no-name-14eaecde-58e4-44ae-bca7-fcde95f7d864
[I 2026-06-19 18:28:50,749] Trial 0 finished with value: 0.6921421535664859 and parameters: {'family': 'extra_trees', 'percentile': 80, 'n_estimators': 400, 'min_samples_leaf': 1, 'max_depth': '4'}. Best is trial 0 with value: 0.6921421535664859.
[I 2026-06-19 18:28:56,179] Trial 1 finished with value: 0.7383418570362191 and parameters: {'family': 'logistic', 'percentile': 50, 'logistic_c': 0.0066240595682091315}. Best is trial 1 with value: 0.7383418570362191.
[I 2026-06-19 18:29:01,489] Trial 2 finished with value: 0.7442128272988807 and parameters: {'family': 'extra_trees', 'percentile': 60, 'n_estimators': 700, 'min_samples_leaf': 1, 'max_depth': '12'}. Best is trial 2 with value: 0.7442128272988807.
[I 2026-06-19 18:29:03,209] Trial 3 finished with value: 0.6921421535664859 and parameters: {'family': 'extra_trees', 'percentile': 80, 'n_estimators': 400, 'min_samples_leaf': 1, 'max_depth': '4'}. Best is trial 2 with value: 0.7442128272988807.
[I 2026-06-19 18:29:07,792] Trial 4 finished with value: 0.7419096795951396 and parameters: {'family': 'logistic', 'percentile': 70, 'logistic_c': 0.0014254814784217286}. Best is trial 2 with value: 0.7442128272988807.
[I 2026-06-19 18:29:26,879] Trial 5 finished with value: 0.7336512499717247 and parameters: {'family': 'logistic', 'percentile': 60, 'logistic_c': 0.21301372721189435}. Best is trial 2 with value: 0.7442128272988807.
[I 2026-06-19 18:29:39,915] Trial 6 finished with value: 0.7196359792798962 and parameters: {'family': 'random_forest', 'percentile': 90, 'n_estimators': 1000, 'min_samples_leaf': 5, 'max_depth': '4'}. Best is trial 2 with value: 0.7442128272988807.
[I 2026-06-19 18:29:46,305] Trial 7 finished with value: 0.7473755426277682 and parameters: {'family': 'extra_trees', 'percentile': 90, 'n_estimators': 500, 'min_samples_leaf': 2, 'max_depth': '16'}. Best is trial 7 with value: 0.7473755426277682.
[I 2026-06-19 18:30:40,093] Trial 8 finished with value: 0.7093612672247688 and parameters: {'family': 'logistic', 'percentile': 90, 'logistic_c': 1.4611205138065535}. Best is trial 7 with value: 0.7473755426277682.
[I 2026-06-19 18:30:43,761] Trial 9 finished with value: 0.7455042351184785 and parameters: {'family': 'extra_trees', 'percentile': 60, 'n_estimators': 300, 'min_samples_leaf': 5, 'max_depth': 'none'}. Best is trial 7 with value: 0.7473755426277682.
[I 2026-06-19 18:30:59,747] Trial 10 finished with value: 0.7483975644213032 and parameters: {'family': 'random_forest', 'percentile': 40, 'n_estimators': 700, 'min_samples_leaf': 3, 'max_depth': '16'}. Best is trial 10 with value: 0.7483975644213032.
[I 2026-06-19 18:31:15,697] Trial 11 finished with value: 0.7483975644213032 and parameters: {'family': 'random_forest', 'percentile': 40, 'n_estimators': 700, 'min_samples_leaf': 3, 'max_depth': '16'}. Best is trial 10 with value: 0.7483975644213032.
[I 2026-06-19 18:31:31,566] Trial 12 finished with value: 0.7483975644213032 and parameters: {'family': 'random_forest', 'percentile': 40, 'n_estimators': 700, 'min_samples_leaf': 3, 'max_depth': '16'}. Best is trial 10 with value: 0.7483975644213032.
[I 2026-06-19 18:31:42,578] Trial 13 finished with value: 0.7385207622596346 and parameters: {'family': 'random_forest', 'percentile': 40, 'n_estimators': 700, 'min_samples_leaf': 3, 'max_depth': '8'}. Best is trial 10 with value: 0.7483975644213032.
[I 2026-06-19 18:32:02,789] Trial 14 finished with value: 0.7488972652177399 and parameters: {'family': 'random_forest', 'percentile': 40, 'n_estimators': 900, 'min_samples_leaf': 3, 'max_depth': '16'}. Best is trial 14 with value: 0.7488972652177399.
[I 2026-06-19 18:32:26,915] Trial 15 finished with value: 0.7516178584427843 and parameters: {'family': 'random_forest', 'percentile': 50, 'n_estimators': 1000, 'min_samples_leaf': 4, 'max_depth': '16'}. Best is trial 15 with value: 0.7516178584427843.
[I 2026-06-19 18:32:51,166] Trial 16 finished with value: 0.7516178584427843 and parameters: {'family': 'random_forest', 'percentile': 50, 'n_estimators': 1000, 'min_samples_leaf': 4, 'max_depth': '16'}. Best is trial 15 with value: 0.7516178584427843.
[I 2026-06-19 18:33:12,786] Trial 17 finished with value: 0.7506277105683635 and parameters: {'family': 'random_forest', 'percentile': 50, 'n_estimators': 1000, 'min_samples_leaf': 4, 'max_depth': '12'}. Best is trial 15 with value: 0.7516178584427843.
[I 2026-06-19 18:33:36,301] Trial 18 finished with value: 0.7556401413968181 and parameters: {'family': 'random_forest', 'percentile': 50, 'n_estimators': 900, 'min_samples_leaf': 4, 'max_depth': 'none'}. Best is trial 18 with value: 0.7556401413968181.
[I 2026-06-19 18:34:04,880] Trial 19 finished with value: 0.7534521510782639 and parameters: {'family': 'random_forest', 'percentile': 70, 'n_estimators': 900, 'min_samples_leaf': 4, 'max_depth': 'none'}. Best is trial 18 with value: 0.7556401413968181.
[I 2026-06-19 18:34:34,642] Trial 20 finished with value: 0.7529349710358614 and parameters: {'family': 'random_forest', 'percentile': 100, 'n_estimators': 800, 'min_samples_leaf': 5, 'max_depth': 'none'}. Best is trial 18 with value: 0.7556401413968181.
[I 2026-06-19 18:35:04,290] Trial 21 finished with value: 0.7529349710358614 and parameters: {'family': 'random_forest', 'percentile': 100, 'n_estimators': 800, 'min_samples_leaf': 5, 'max_depth': 'none'}. Best is trial 18 with value: 0.7556401413968181.
[I 2026-06-19 18:35:38,413] Trial 22 finished with value: 0.7550571571343085 and parameters: {'family': 'random_forest', 'percentile': 100, 'n_estimators': 900, 'min_samples_leaf': 4, 'max_depth': 'none'}. Best is trial 18 with value: 0.7556401413968181.
[I 2026-06-19 18:36:07,271] Trial 23 finished with value: 0.7534521510782639 and parameters: {'family': 'random_forest', 'percentile': 70, 'n_estimators': 900, 'min_samples_leaf': 4, 'max_depth': 'none'}. Best is trial 18 with value: 0.7556401413968181.
[I 2026-06-19 18:36:35,983] Trial 24 finished with value: 0.7534521510782639 and parameters: {'family': 'random_forest', 'percentile': 70, 'n_estimators': 900, 'min_samples_leaf': 4, 'max_depth': 'none'}. Best is trial 18 with value: 0.7556401413968181.
[I 2026-06-19 18:37:02,858] Trial 25 finished with value: 0.752323197427055 and parameters: {'family': 'random_forest', 'percentile': 80, 'n_estimators': 800, 'min_samples_leaf': 4, 'max_depth': 'none'}. Best is trial 18 with value: 0.7556401413968181.
[I 2026-06-19 18:37:37,005] Trial 26 finished with value: 0.7550571571343085 and parameters: {'family': 'random_forest', 'percentile': 100, 'n_estimators': 900, 'min_samples_leaf': 4, 'max_depth': 'none'}. Best is trial 18 with value: 0.7556401413968181.
[I 2026-06-19 18:37:55,863] Trial 27 finished with value: 0.7467791918830495 and parameters: {'family': 'random_forest', 'percentile': 100, 'n_estimators': 800, 'min_samples_leaf': 2, 'max_depth': '8'}. Best is trial 18 with value: 0.7556401413968181.
[I 2026-06-19 18:38:27,549] Trial 28 finished with value: 0.7558293285296253 and parameters: {'family': 'random_forest', 'percentile': 90, 'n_estimators': 900, 'min_samples_leaf': 5, 'max_depth': 'none'}. Best is trial 28 with value: 0.7558293285296253.
[I 2026-06-19 18:39:35,026] Trial 29 finished with value: 0.7079012360911471 and parameters: {'family': 'logistic', 'percentile': 90, 'logistic_c': 24.743303275607825}. Best is trial 28 with value: 0.7558293285296253.
[I 2026-06-19 18:39:42,733] Trial 30 finished with value: 0.7496519573670909 and parameters: {'family': 'extra_trees', 'percentile': 80, 'n_estimators': 600, 'min_samples_leaf': 5, 'max_depth': 'none'}. Best is trial 28 with value: 0.7558293285296253.
[I 2026-06-19 18:40:16,079] Trial 31 finished with value: 0.7527437275211756 and parameters: {'family': 'random_forest', 'percentile': 100, 'n_estimators': 900, 'min_samples_leaf': 5, 'max_depth': 'none'}. Best is trial 28 with value: 0.7558293285296253.
[I 2026-06-19 18:40:50,210] Trial 32 finished with value: 0.7550571571343085 and parameters: {'family': 'random_forest', 'percentile': 100, 'n_estimators': 900, 'min_samples_leaf': 4, 'max_depth': 'none'}. Best is trial 28 with value: 0.7558293285296253.
[I 2026-06-19 18:41:19,340] Trial 33 finished with value: 0.7541739411175613 and parameters: {'family': 'random_forest', 'percentile': 90, 'n_estimators': 800, 'min_samples_leaf': 4, 'max_depth': 'none'}. Best is trial 28 with value: 0.7558293285296253.
[I 2026-06-19 18:41:56,210] Trial 34 finished with value: 0.7525278074239499 and parameters: {'family': 'random_forest', 'percentile': 100, 'n_estimators': 1000, 'min_samples_leaf': 5, 'max_depth': 'none'}. Best is trial 28 with value: 0.7558293285296253.
[I 2026-06-19 18:42:13,608] Trial 35 finished with value: 0.7195629777232151 and parameters: {'family': 'logistic', 'percentile': 90, 'logistic_c': 0.04150000647701572}. Best is trial 28 with value: 0.7558293285296253.
